|Unnamed: 0|id|fecha|anio|mes|dia|rol|victima|sexo|edad|fecha_deceso|edad_rango|dia_semana|acusado|hora_rango|x|y|lugar|direc_norm|comuna
135|135|2016-0168|2016-12-13|2016|12|13|CONDUCTOR|MOTO|MASCULINO|43.0|2016-12-13 00:00:00|5|Tuesday|AUTO|10|-58.42323628|-34.64119105|AV LA PLATA Y CNEL GREGORIO POMAR|LA PLATA AV. y POMAR, GREGORIO TTE. CNEL.|4
136|136|2016-0169|2016-12-15|2016|12|15|CONDUCTOR|MOTO|MASCULINO|24.0|2016-12-16 00:00:00|4|Thursday|PASAJEROS|15|-58.47935434|-34.55676497|NUÑEZ Y AV RICARDO BALBIN|NUÃ‘EZ y BALBIN, RICARDO, DR. AV.|12
137|137|2016-0170|2016-12-19|2016|12|19|PASAJERO_ACOMPAÑANTE|MOTO|MASCULINO|21.0|2016-12-19 00:00:00|4|Monday|AUTO|17|-58.50598256|-34.5637998|AV GRAL PAZ 4500|PAZ, GRAL. AV. 4500|12
138|138|2016-0171|2016-12-25|2016|12|25|CONDUCTOR|MOTO|SD||SD|6|Sunday|MOTO|19|-58.36607137|-34.62150748|AU BUENOS AIRES - LA PLATA Y AU 25 DE MAYO|HUERGO, ING. AV. y AUTOPISTA 25 DE MAYO|1
139|139|2016-0172|2016-12-26|2016|12|26|CONDUCTOR|MOTO|MASCULINO|38.0|2016-12-26 00:00:00|5|Monday|CARGAS|8|-58.41918902|-34.63174259|AV GARAY Y CASTRO|GARAY, JUAN DE AV. y CASTRO|5
140|140|2016-0173|2016-12-26|2016|12|26|CONDUCTOR|MOTO|MASCULINO|35.0|SD|5|Monday|CARGAS|19|-58.46749188|-34.63551751|AV DIRECTORIO Y AV SAN PEDRITO|DIRECTORIO AV. y SAN PEDRITO AV.|7
141|141|2016-0174|2016-12-27|2016|12|27|SD|SD|SD||SD|6|Tuesday|SD|0|0.0|0.0|AUTOPISTA 25 DE MAYO|AUTOPISTA 25 DE MAYO|0
142|142|2016-0175|2016-12-27|2016|12|27|PEATON|PEATON|FEMENINO||SD|6|Tuesday|BICICLETA|8|-58.46064174|-34.62960517|CNEL RAMON L FALCON Y MEMBRILLAR|FALCON, RAMON L.,CNEL. y MEMBRILLAR|7
143|143|2016-0176|2016-12-28|2016|12|28|CONDUCTOR|MOTO|MASCULINO|28.0|SD|4|Wednesday|PASAJEROS|1|-58.36956186|-34.61232875|AV BELGRANO Y AV PASEO COLON|BELGRANO AV. y PASEO COLON AV.|1
144|144|2016-0177|2016-12-29|2016|12|29|PEATON|PEATON|FEMENINO|27.0|SD|4|Thursday|AUTO|4|-58.40966671|-34.58788235|ARENALES 3319|ARENALES 3319|14
145|145|2016-0178|2016-12-30|2016|12|30|PEATON|PEATON|FEMENINO|7.0|SD|2|Friday|MULTIPLE|16|-58.40288226|-34.61544091|REPUBLICA BOLIVARIANA DE VENEZUELA Y SAAVEDRA|REPUBLICA BOLIVARIANA DE VENEZUELA y SAAVEDRA|3
146|146|2017-0001|2017-01-02|2017|1|2|CONDUCTOR|MOTO|MASCULINO|18.0|2017-01-02 00:00:00|4|Monday|CARGAS|1|-58.4659423|-34.61028571|AV. JUAN B JUSTO Y ACHUPALLAS|JUSTO, JUAN B. AV. y ACHUPALLAS|11
147|147|2017-0003|2017-01-05|2017|1|5|PASAJERO_ACOMPAÑANTE|CARGAS|MASCULINO|33.0|2017-01-05 00:00:00|5|Thursday|CARGAS|3|-58.38957669|-34.64410277|OLAVARRIA Y AV. VELEZ SARSFIELD|OLAVARRIA y VELEZ SARSFIELD AV.|4
148|148|2017-0007|2017-01-11|2017|1|11|PEATON|PEATON|MASCULINO|48.0|2017-01-11 00:00:00|5|Wednesday|MULTIPLE|17|-58.3816166|-34.61529543|LIMA Y MEXICO|LIMA y MEXICO|1
149|149|2017-0008|2017-01-16|2017|1|16|CONDUCTOR|MOTO|MASCULINO|29.0|2017-01-16 00:00:00|4|Monday|PASAJEROS|0|-58.43917004|-34.58494351|JOSE A CABRERA Y BONPLAND|CABRERA, JOSE A. y BONPLAND|14
150|150|2017-0009|2017-01-16|2017|1|16|CONDUCTOR|MOTO|MASCULINO|36.0|2017-01-16 00:00:00|5|Monday|CARGAS|13|-58.41595919|-34.62743346|AU 25 DE MAYO Y AV. BOEDO|AUTOPISTA 25 DE MAYO y BOEDO AV.|5
151|151|2017-0010|2017-01-16|2017|1|16|CONDUCTOR|MOTO|MASCULINO|23.0|2017-01-16 00:00:00|4|Monday|AUTO|16|-58.4356488|-34.62828656|AV. DIRECTORIO Y RIGLOS|DIRECTORIO AV. y RIGLOS|6
152|152|2017-0011|2017-01-22|2017|1|22|PASAJERO_ACOMPAÑANTE|MOTO|FEMENINO|29.0|2017-01-22 00:00:00|4|Sunday|OBJETO FIJO|2|-58.5007381|-34.5497951|AV. GRAL. PAZ Y AV. R. BALBIN|PAZ, GRAL. AV. y BALBIN, RICARDO, DR. AV.|12
153|153|2017-0012|2017-01-24|2017|1|24|CONDUCTOR|MOTO|MASCULINO|30.0|2017-01-24 00:00:00|5|Tuesday|CARGAS|14|-58.40969005|-34.6505529|TRAFUL Y DIOGENES TABORDA|TRAFUL y TABORDA, DIOGENES|4
154|154|2017-0013|2017-01-27|2017|1|27|PEATON|PEATON|MASCULINO|4.0|2017-01-27 00:00:00|1|Friday|CARGAS|7|-58.38972622|-34.65098981|IRIARTE 3055|IRIARTE, GRAL. AV. 3055|4
155|155|2017-0014|2017-01-28|2017|1|28|PASAJERO_ACOMPAÑANTE|MOTO|FEMENINO|22.0|2017-01-28 00:00:00|4|Saturday|MULTIPLE|8|-58.49185972|-34.55046754|AV. DONADO Y ARIAS|DONADO y ARIAS|12
156|156|2017-0015|2017-02-02|2017|2|2|PEATON|PEATON|MASCULINO|82.0|2017-02-21 00:00:00|6|Thursday|AUTO|15|-58.39293417|-34.59963642|CORDOBA AV. Y CALLAO|CORDOBA AV. y CALLAO AV.|2
157|157|2017-0016|2017-02-03|2017|2|3|CONDUCTOR|MOTO|MASCULINO|27.0|2017-02-04 00:00:00|4|Friday|CARGAS|5|-58.38099494|-34.62288231|AU 25 DE MAYO, KILOMETRO 8.3, SENTIDO HACIA PROVINCIA DE BUENOS AIRES, C.A.B.A.|AUTOPISTA 25 DE MAYO KM. 8.3|1
158|158|2017-0017|2017-02-06|2017|2|6|CONDUCTOR|MOTO|MASCULINO|32.0|2017-02-06 00:00:00|5|Monday|AUTO|8|-58.429012|-34.58095431|AV. JUAN B JUSTO Y PARAGUAY|JUSTO, JUAN B. AV. y PARAGUAY|14
159|159|2017-0018|2017-02-09|2017|2|9|CONDUCTOR|MOTO|MASCULINO|30.0|2017-02-09 00:00:00|5|Thursday|AUTO|7|-58.50877521|-34.66977709|AV. GRAL. PAZ Y AV. DE LOS CORRALES|PAZ, GRAL. AV. y DE LOS CORRALES AV.|9
160|160|2017-0021|2017-02-18|2017|2|18|CONDUCTOR|MOTO|MASCULINO|43.0|2017-02-18 00:00:00|5|Saturday|PASAJEROS|5|-58.38362373|-34.60509972|SARMIENTO Y LIBERTAD|SARMIENTO y LIBERTAD|1
161|161|2017-0024|2017-02-23|2017|2|23|PEATON|PEATON|MASCULINO|39.0|2017-02-23 00:00:00|5|Thursday|PASAJEROS|20|-58.46589308|-34.62955795|AV. RIVADAVIA 7121|RIVADAVIA AV. 7121|7
162|162|2017-0025|2017-02-24|2017|2|24|CONDUCTOR|MOTO|MASCULINO|23.0|2017-02-24 00:00:00|4|Friday|SD|17|-58.43614426|-34.6542464|AV. FERNANDEZ DE LA CRUZ Y RIVERA INDARTE|FERNANDEZ DE LA CRUZ, F., GRAL. AV. y RIVERA INDARTE AV.|7
163|163|2017-0026|2017-02-26|2017|2|26|PASAJERO_ACOMPAÑANTE|AUTO|FEMENINO|23.0|2017-02-26 00:00:00|4|Sunday|OBJETO FIJO|5|-58.41842777|-34.64979057|AV. PERITO MORENO Y FOURNIER|MORENO, PERITO AV. y FOURNIER|4
164|164|2017-0026|2017-02-26|2017|2|26|CONDUCTOR|AUTO|MASCULINO|19.0|2017-02-26 00:00:00|4|Sunday|OBJETO FIJO|5|-58.41842777|-34.64979057|AV. PERITO MORENO Y FOURNIER|MORENO, PERITO AV. y FOURNIER|4
165|165|2017-0027|2017-02-26|2017|2|26|PEATON|PEATON|MASCULINO||2017-02-26 00:00:00|6|Sunday|AUTO|21|-58.38332245|-34.6319325|AV. CASEROS 1429|CASEROS AV. 1429|1
166|166|2017-0028|2017-02-28|2017|2|28|PEATON|PEATON|MASCULINO|87.0|2017-02-28 00:00:00|6|Tuesday|AUTO|9|-58.45475488|-34.61196327|AV. GAONA Y FRAGATA SARMIENTO|GAONA AV. y FRAGATA PRES. SARMIENTO|6
167|167|2017-0029|2017-03-07|2017|3|7|SD|SD|MASCULINO|34.0|2017-03-07 00:00:00|5|Tuesday|AUTO|2|-58.48501341|-34.64742455|MOZART Y TANDIL|MOZART y TANDIL|9
168|168|2017-0030|2017-03-07|2017|3|7|CONDUCTOR|AUTO|FEMENINO|27.0|2017-03-07 00:00:00|4|Tuesday|PASAJEROS|8|-58.47010988|-34.65872088|MOZART Y COLECTORA AV. TTE. LUIS J DELLEPIANE|MOZART y AUTOPISTA DELLEPIANE LUIS TTE. GRAL.|9
169|169|2017-0031|2017-03-11|2017|3|11|PASAJERO_ACOMPAÑANTE|AUTO|MASCULINO|70.0|2017-03-11 00:00:00|6|Saturday|OBJETO FIJO|1|-58.4099756|-34.62873635|24 DE NOVIEMBRE Y PAVON |24 DE NOVIEMBRE y PAVON|3
170|170|2017-0032|2017-03-12|2017|3|12|PASAJERO_ACOMPAÑANTE|AUTO|FEMENINO|40.0|2017-03-12 00:00:00|5|Sunday|AUTO|5|-58.48892175|-34.68359163|AV. GRAL. PAZ Y PEDRO DE MENDOZA|PAZ, GRAL. AV. y LOS CEDROS|8
171|171|2017-0033|2017-03-12|2017|3|12|CONDUCTOR|AUTO|MASCULINO|28.0|2017-03-12 00:00:00|4|Sunday|AUTO|7|-58.52466448|-34.60325478|AV. GRAL. PAZ KM. 10|PAZ, GRAL. AV. y GUTIERREZ, RICARDO|11
172|172|2017-0034|2017-03-13|2017|3|13|PEATON|PEATON|MASCULINO|43.0|2017-03-13 00:00:00|5|Monday|AUTO|7|-58.42554218|-34.57929036|GODOY CRUZ 2651|GODOY CRUZ 2651|14
173|173|2017-0035|2017-03-23|2017|3|23|CONDUCTOR|AUTO|MASCULINO|28.0|2017-03-23 00:00:00|4|Thursday|OBJETO FIJO|5|-58.35881506|-34.61113641|AV. DR. TRISTAN ACHAVAL RODRIGUEZ Y BLVD. AZUCENA VILLAFLOR|ACHAVAL RODRIGUEZ, T., DR. AV. y VILLAFLOR, AZUCENA|1
174|174|2017-0035|2017-03-23|2017|3|23|PASAJERO_ACOMPAÑANTE|AUTO|MASCULINO|32.0|2017-03-23 00:00:00|5|Thursday|OBJETO FIJO|5|-58.35881506|-34.61113641|AV. DR. TRISTAN ACHAVAL RODRIGUEZ Y BLVD. AZUCENA VILLAFLOR|ACHAVAL RODRIGUEZ, T., DR. AV. y VILLAFLOR, AZUCENA|1
175|175|2017-0035|2017-03-23|2017|3|23|PASAJERO_ACOMPAÑANTE|AUTO|MASCULINO|30.0|2017-03-23 00:00:00|5|Thursday|OBJETO FIJO|5|-58.35881506|-34.61113641|AV. DR. TRISTAN ACHAVAL RODRIGUEZ Y BLVD. AZUCENA VILLAFLOR|ACHAVAL RODRIGUEZ, T., DR. AV. y VILLAFLOR, AZUCENA|1
176|176|2017-0036|2017-03-29|2017|3|29|PASAJERO_ACOMPAÑANTE|MOTO|FEMENINO||2017-03-29 00:00:00|6|Wednesday|PASAJEROS|18|-58.51452347|-34.58159762|CURUPAYTI Y COLECTORA AV. GRAL. PAZ|PAZ, GRAL. AV. y CAMPANA|12
177|177|2017-0036|2017-03-29|2017|3|29|CONDUCTOR|MOTO|MASCULINO|20.0|2017-03-29 00:00:00|4|Wednesday|PASAJEROS|18|-58.51452347|-34.58159762|CURUPAYTI Y COLECTORA AV. GRAL. PAZ|PAZ, GRAL. AV. y CAMPANA|12
178|178|2017-0037|2017-03-31|2017|3|31|CONDUCTOR|MOTO|MASCULINO|41.0|2017-03-31 00:00:00|5|Friday|CARGAS|3|-58.38896772|-34.61799615|AV. INDEPENDENCIA Y VIRREY CEVALLOS|INDEPENDENCIA AV. y CEVALLOS, VIRREY|1
179|179|2017-0038|2017-04-01|2017|4|1|CONDUCTOR|MOTO|FEMENINO|40.0|2017-04-01 00:00:00|5|Saturday|AUTO|19|-58.44516857|-34.64363363|AV. CASTAÑARES Y LAUTARO|CASTAÃ‘ARES AV. y LAUTARO|7
180|180|2017-0040|2017-04-03|2017|4|3|CONDUCTOR|AUTO|MASCULINO|43.0|2017-04-03 00:00:00|5|Monday|MULTIPLE|9|-58.43834197|-34.54560369|CAMINO CIUDAD UNUVERSITARIA Y AV. TTE. GUIRALDES|GUIRALDES, INT. 2699|13
181|181|2017-0041|2017-04-03|2017|4|3|CONDUCTOR|MOTO|MASCULINO|17.0|SD|3|Monday|AUTO|23|-58.45485084|-34.63531854|BALDOMERO FERNANDEZ MORENO 2186|FERNANDEZ MORENO, BALDOMERO 2186|7
182|182|2017-0042|2017-04-10|2017|4|10|CONDUCTOR|MOTO|MASCULINO||2017-04-10 00:00:00|6|Monday|CARGAS|9|0.0|0.0|AV. LEOPOLDO LUGONES PKM 6900|LUGONES, LEOPOLDO AV.|14
183|183|2017-0045|2017-04-14|2017|4|14|CONDUCTOR|MOTO|MASCULINO|21.0|2017-04-14 00:00:00|4|Friday|OBJETO FIJO|6|-58.52449285|-34.62454175|NOGOYA 5940|NOGOYA 5940|10
184|184|2017-0047|2017-04-23|2017|4|23|CONDUCTOR|MOTO|MASCULINO|37.0|2017-04-23 00:00:00|5|Sunday|AUTO|6|-58.46713742|-34.6719879|AV. ARGENTINA Y AV. CORVALAN|ARGENTINA AV. y CORVALAN|8
185|185|2017-0049|2017-04-27|2017|4|27|PEATON|PEATON|MASCULINO|22.0|2017-04-27 00:00:00|4|Thursday|PASAJEROS|18|-58.43850413|-34.65554754|AV. FERNANDEZ DE LA CRUZ Y VARELA|FERNANDEZ DE LA CRUZ, F., GRAL. AV. y VARELA AV.|8
186|186|2017-0050|2017-04-28|2017|4|28|CONDUCTOR|MOTO|MASCULINO|46.0|2017-04-28 00:00:00|5|Friday|CARGAS|11|0.0|0.0|AU PERITO MORENO Y RAMAL ENLACE AU1/AU6||9
187|187|2017-0050|2017-04-28|2017|4|28|PASAJERO_ACOMPAÑANTE|MOTO|MASCULINO|16.0|2017-04-28 00:00:00|3|Friday|CARGAS|11|0.0|0.0|AU PERITO MORENO Y RAMAL ENLACE AU1/AU6||9
188|188|2017-0051|2017-05-01|2017|5|1|CONDUCTOR|AUTO|MASCULINO|33.0|2017-05-01 00:00:00|5|Monday|AUTO|3|0.0|0.0|AU DELLEPIANE 2400||7
189|189|2017-0052|2017-05-05|2017|5|5|PEATON|PEATON|FEMENINO|47.0|2017-05-05 00:00:00|5|Friday|CARGAS|3|-58.49413799|-34.68095739|AV. GRAL. PAZ Y GOLETA JULIA|PAZ, GRAL. AV. y GOLETA SANTA CRUZ|8
190|190|2017-0053|2017-05-05|2017|5|5|CONDUCTOR|MOTO|MASCULINO|28.0|2017-05-05 00:00:00|4|Friday|CARGAS|20|-58.37547846|-34.65326075|VIEYTES Y VILLARINO|VIEYTES y VILLARINO|4
191|191|2017-0054|2017-05-07|2017|5|7|PASAJERO_ACOMPAÑANTE|MOTO|FEMENINO|20.0|2017-05-07 00:00:00|4|Sunday|AUTO|21|-58.48680218|-34.58689719|AV. DE LOS CONSTITUYENTES Y PEDRO MORAN|DE LOS CONSTITUYENTES AV. y MORAN, PEDRO|15
192|192|2017-0055|2017-05-09|2017|5|9|CONDUCTOR|AUTO|MASCULINO|32.0|2017-05-09 00:00:00|5|Tuesday|AUTO|8|-58.49563989|-34.57962262|AV. DE LOS CONSTITUYENTES 4900|DE LOS CONSTITUYENTES AV. 4900|12
193|193|2017-0058|2017-05-09|2017|5|9|PEATON|PEATON|MASCULINO|80.0|2017-05-09 00:00:00|6|Tuesday|MOTO|23|-58.38403232|-34.5991594|AV. CORDOBA Y LIBERTAD|CORDOBA AV. y LIBERTAD|1
194|194|2017-0059|2017-05-11|2017|5|11|PEATON|PEATON|FEMENINO|39.0|2017-05-11 00:00:00|5|Thursday|PASAJEROS|9|-58.38223382|-34.62693865|BRASIL Y LIMA|BRASIL y LIMA|1
195|195|2017-0060|2017-05-13|2017|5|13|PASAJERO_ACOMPAÑANTE|MOTO|MASCULINO|30.0|2017-05-13 00:00:00|5|Saturday|OBJETO FIJO|7|-58.45966521|-34.67323292|AV. ESCALADA Y AV. FERNANDEZ DE LA CRUZ|ESCALADA AV. y FERNANDEZ DE LA CRUZ, F., GRAL. AV.|8
196|196|2017-0061|2017-05-15|2017|5|15|PEATON|PEATON|MASCULINO|47.0|2017-05-16 00:00:00|5|Monday|MOTO|13|-58.39303911|-34.59871111|PARAGUAY Y AV. CALLAO |PARAGUAY y CALLAO AV.|2
197|197|2017-0062|2017-05-15|2017|5|15|CONDUCTOR|MOTO|MASCULINO|35.0|2017-05-15 00:00:00|5|Monday|CARGAS|16|-58.51262106|-34.63395999|AV. JUAN B JUSTO Y SAN BLAS|JUSTO, JUAN B. AV. y SAN BLAS|10
198|198|2017-0063|2017-05-17|2017|5|17|PEATON|PEATON|FEMENINO|79.0|2017-05-17 00:00:00|6|Wednesday|PASAJEROS|10|-58.38118367|-34.61646839|CHILE Y AV. 9 DE JULIO|CHILE y 9 DE JULIO AV.|1
199|199|2017-0064|2017-05-20|2017|5|20|PASAJERO_ACOMPAÑANTE|CARGAS|MASCULINO|61.0|2017-05-20 00:00:00|6|Saturday|AUTO|5|-58.37653284|-34.60582475|MAIPU Y PERON|MAIPU y PERON, JUAN DOMINGO, TTE. GENERAL|1
200|200|2017-0065|2017-05-22|2017|5|22|CICLISTA|BICICLETA|MASCULINO|21.0|2017-05-22 00:00:00|4|Monday|CARGAS|16|-58.37709334|-34.64035082|AV. SUAREZ Y HERRERA|SUAREZ AV. y HERRERA|4
201|201|2017-0066|2017-05-22|2017|5|22|PEATON|PEATON|MASCULINO|10.0|2017-05-22 00:00:00|2|Monday|PASAJEROS|18|-58.46002142|-34.60409469|AV. SAN MARTIN Y FRAGATA SARMIENTO|SAN MARTIN AV. y FRAGATA PRES. SARMIENTO|15
202|202|2017-0067|2017-05-23|2017|5|23|CONDUCTOR|MOTO|MASCULINO|21.0|2017-05-23 00:00:00|4|Tuesday|CARGAS|2|-58.4338197|-34.62801894|AV. DIRECTORIO Y AV. JOSE MARIA MORENO|DIRECTORIO AV. y MORENO, JOSE MARIA AV.|6
203|203|2017-0068|2017-05-27|2017|5|27|CONDUCTOR|MOTO|MASCULINO|32.0|2017-05-27 00:00:00|5|Saturday|OBJETO FIJO|19|-58.43580656|-34.66437532|AV. TTE. FRANCISCO RABANAL 2950|RABANAL, FRANCISCO, INTENDENTE AV. 2950|8
204|204|2017-0069|2017-05-29|2017|5|29|CONDUCTOR|MOTO|MASCULINO|39.0|2017-05-29 00:00:00|5|Wednesday|SD|14|-58.52173071|-34.65997463|AV. GRAL. PAZ Y ULRICO SCHMIDL|PAZ, GRAL. AV. y SCHMIDL, ULRICO|9
205|205|2017-0070|2017-05-30|2017|5|30|PEATON|PEATON|MASCULINO|80.0|2017-05-31 00:00:00|6|Tuesday|AUTO|13|-58.50791763|-34.59804273|NUEVA YORK  3696|NUEVA YORK 3696|11
206|206|2017-0072|2017-06-03|2017|6|3|CONDUCTOR|AUTO|MASCULINO|25.0|2017-06-03 00:00:00|4|Saturday|AUTO|23|-58.49175088|-34.58226957|AV. DE LOS CONSTITUYENTES Y VALLEJOS|DE LOS CONSTITUYENTES AV. y VALLEJOS|12
207|207|2017-0073|2017-06-04|2017|6|4|CONDUCTOR|MOTO|MASCULINO|19.0|2017-06-04 00:00:00|4|Sunday|AUTO|9|-58.40781467|-34.60425669|AV. CORRIENTES Y ECUADOR|CORRIENTES AV. y ECUADOR|3
208|208|2017-0074|2017-06-04|2017|6|4|SD|SD|MASCULINO|70.0|2017-06-04 00:00:00|6|Sunday|SD|12|-58.52567073|-34.63787791|CASCO 133|CASCO 133|9
209|209|2017-0075|2017-06-12|2017|6|12|PEATON|PEATON|MASCULINO|55.0|2017-06-12 00:00:00|5|Monday|MOTO|22|-58.381542|-34.60906385|AV. DE MAYO Y AV. 9 DE JULIO|DE MAYO AV. y 9 DE JULIO AV.|1
210|210|2017-0076|2017-06-13|2017|6|13|PEATON|PEATON|FEMENINO|30.0|2017-06-13 00:00:00|5|Tuesday|CARGAS|14|-58.38526125|-34.5780581|AV. RAMON CASTILLO Y CALLE 12|CASTILLO, RAMON S., PRES. AV. y CALLE 12 (NO OFICIAL)|2
211|211|2017-0077|2017-06-17|2017|6|17|CONDUCTOR|MOTO|FEMENINO|60.0|2017-06-18 00:00:00|6|Saturday|CARGAS|23|-58.42934104|-34.58451712|FRAY JUSTO SANTAMARIA DE ORO 1930|FRAY JUSTO SANTAMARIA DE ORO 1930|14
212|212|2017-0079|2017-06-19|2017|6|19|CONDUCTOR|MOTO|MASCULINO|33.0|2017-06-19 00:00:00|5|Monday|CARGAS|16|-58.40657493|-34.61781124|MEXICO Y DEAN FUNES|MEXICO y DEAN FUNES|3
213|213|2017-0080|2017-06-22|2017|6|22|PEATON|PEATON|FEMENINO|95.0|2017-06-22 00:00:00|6|Thursday|CARGAS|10|-58.49525314|-34.64487785|AV. JUAN B ALBERDI Y AV. ESCALADA|ALBERDI, JUAN BAUTISTA AV. y ESCALADA AV.|9
214|214|2017-0082|2017-06-25|2017|6|25|PEATON|PEATON|MASCULINO|36.0|2017-06-25 00:00:00|5|Sunday|AUTO|22|-58.39092851|-34.62932696|AV. ENTRE RIOS Y AV. BRASIL|ENTRE RIOS AV. y BRASIL|4
215|215|2017-0083|2017-07-04|2017|7|4|CONDUCTOR|MOTO|MASCULINO|37.0|2017-07-04 00:00:00|5|Tuesday|CARGAS|0|-58.49603546|-34.64564271|AV. JUAN B ALBERDI Y GUARDIA NACIONAL|ALBERDI, JUAN BAUTISTA AV. y GUARDIA NACIONAL|9
216|216|2017-0084|2017-07-05|2017|7|5|PEATON|PEATON|FEMENINO|73.0|2017-07-05 00:00:00|6|Wednesday|PASAJEROS|12|-58.38502878|-34.58703485|AV. DEL LIBERTADOR Y RODRIGUEZ PEÑA|DEL LIBERTADOR AV. y RODRIGUEZ PEÃ‘A|2
217|217|2017-0085|2017-07-07|2017|7|7|PEATON|PEATON|MASCULINO|84.0|2017-07-07 00:00:00|6|Friday|PASAJEROS|14|-58.37261143|-34.63150425|TACUARI Y AV. MARTIN GARCIA|TACUARI y GARCIA, MARTIN AV.|4
218|218|2017-0086|2017-07-09|2017|7|9|PEATON|PEATON|FEMENINO|30.0|2017-07-09 00:00:00|5|Sunday|MOTO|7|-58.51876802|-34.63905965|AV. RIVADAVIA Y MURGUIONDO|RIVADAVIA AV. y MURGUIONDO|9
219|219|2017-0087|2017-07-10|2017|7|10|PEATON|PEATON|FEMENINO|73.0|2017-07-10 00:00:00|6|Monday|AUTO|10|-58.41095567|-34.61516101|24 DE NOVIEMBRE 390|24 DE NOVIEMBRE 390|3
220|220|2017-0088|2017-07-10|2017|7|10|PEATON|PEATON|MASCULINO|43.0|2017-07-10 00:00:00|5|Monday|PASAJEROS|22|-58.36797542|-34.62519403|AV. PASEO COLON Y BRASIL|PASEO COLON AV. y BRASIL AV.|1
221|221|2017-0089|2017-07-13|2017|7|13|SD|SD|MASCULINO|23.0|SD|4|Thursday|AUTO|12|-58.51514709|-34.64787051|MARTINIANO LEGUIZAMON 901|LEGUIZAMON, MARTINIANO 901|9
222|222|2017-0090|2017-07-15|2017|7|15|PEATON|PEATON|MASCULINO|22.0|2017-07-15 00:00:00|4|Saturday|AUTO|5|-58.51925642|-34.59171721|AV. CHIVILCOY Y COLECTORA AV. GRAL. PAZ |CHIVILCOY AV. y PAZ, GRAL. AV.|11
223|223|2017-0091|2017-07-15|2017|7|15|CONDUCTOR|MOTO|MASCULINO|58.0|2017-07-15 00:00:00|5|Saturday|SD|13|-58.48671535|-34.54321216|SUPERI Y AV. GRAL. PAZ|SUPERI y PAZ, GRAL. AV.|12
224|224|2017-0092|2017-07-24|2017|7|24|PEATON|PEATON|MASCULINO|66.0|2017-07-24 00:00:00|6|Monday|AUTO|22|-58.38268809|-34.62282019|AU 25 DE MAYO Y AU FRONDIZI (9 DE JULIO SUR)|AUTOPISTA 25 DE MAYO y AUTOPISTA 1 SUR PRESIDENTE ARTURO FRONDIZI|1
225|225|2017-0093|2017-07-25|2017|7|25|PEATON|PEATON|MASCULINO||2017-07-25 00:00:00|6|Tuesday|AUTO|16|-58.43633522|-34.54966288|AV. LEOPOLDO LUGONES KM 7,5, ALTURA PUENTE SCALABRINI ORTIZ, SENTIDO A CENTRO PORTEÑO|LUGONES, LEOPOLDO AV. y PUENTE DISTRIBUIDOR SCALABRINI ORTIZ|13
226|226|2017-0094|2017-07-27|2017|7|27|CICLISTA|BICICLETA|FEMENINO|56.0|2017-07-27 00:00:00|5|Thursday|CARGAS|8|-58.52640838|-34.61765855|VICTOR HUGO 2639|HUGO, VICTOR 2639|10
227|227|2017-0095|2017-08-06|2017|8|6|CONDUCTOR|MOTO|MASCULINO|36.0|2017-08-06 00:00:00|5|Sunday|AUTO|8|-58.41894306|-34.59778875|AV. CORDOBA Y JERONIMO SALGUERO|CORDOBA AV. y SALGUERO, JERONIMO|14
228|228|2017-0096|2017-08-07|2017|8|7|PEATON|PEATON|MASCULINO|87.0|2017-08-07 00:00:00|6|Monday|PASAJEROS|19|-58.46756026|-34.54972741|AV. CABILDO Y NUÑEZ|CABILDO AV. y NUÃ‘EZ|13
229|229|2017-0098|2017-08-08|2017|8|8|PEATON|PEATON|FEMENINO|61.0|2017-08-08 00:00:00|6|Tuesday|AUTO|12|-58.45715752|-34.63132912|JOSE BONIFACIO 2114|BONIFACIO, JOSE 2114|7
230|230|2017-0099|2017-08-17|2017|8|17|CICLISTA|BICICLETA|MASCULINO|28.0|2017-08-17 00:00:00|4|Thursday|AUTO|19|-58.42406784|-34.56213916|AV. PTE FIGUEROA ALCORTA 5400|FIGUEROA ALCORTA, PRES. AV. 5400|14
231|231|2017-0100|2017-08-21|2017|8|21|PASAJERO_ACOMPAÑANTE|MOTO|FEMENINO|16.0|2017-08-21 00:00:00|3|Monday|OBJETO FIJO|7|-58.3967447|-34.61512051|VENEZUELA 2135|REPUBLICA BOLIVARIANA DE VENEZUELA 2135|3
232|232|2017-0101|2017-08-23|2017|8|23|PEATON|PEATON|FEMENINO|61.0|2017-08-23 00:00:00|6|Wednesday|MULTIPLE|10|-58.44537508|-34.57084818|AV. FCO. LACROZE Y ZAPATA|LACROZE, FEDERICO AV. y ZAPATA|13
233|233|2017-0102|2017-08-24|2017|8|24|PEATON|PEATON|MASCULINO|46.0|2017-08-24 00:00:00|5|Thursday|CARGAS|1|-58.40056767|-34.6510708|IRIARTE Y ZAVALETA|IRIARTE, GRAL. AV. y ZAVALETA|4
234|234|2017-0104|2017-08-25|2017|8|25|PEATON|PEATON|FEMENINO|18.0|2017-08-25 00:00:00|4|Friday|CARGAS|9|-58.38109568|-34.61853244|AV. 9 DE JULIO Y ESTADOS UNIDOS|9 DE JULIO AV. y ESTADOS UNIDOS|1
235|235|2017-0106|2017-08-31|2017|8|31|PEATON|PEATON|FEMENINO|85.0|2017-08-31 00:00:00|6|Thursday|PASAJEROS|19|-58.42533612|-34.58035258|FRAY JUSTO SANTAMARIA DE ORO Y GUEMES|FRAY JUSTO SANTAMARIA DE ORO y GUEMES|14
236|236|2017-0107|2017-09-01|2017|9|1|CONDUCTOR|MOTO|MASCULINO|41.0|2017-09-01 00:00:00|5|Friday|CARGAS|11|-58.46062311|-34.54395182|AV. DEL LIBERTADOR Y JARAMILLO|DEL LIBERTADOR AV. y JARAMILLO|13
237|237|2017-0108|2017-09-02|2017|9|2|PASAJERO_ACOMPAÑANTE|AUTO|MASCULINO|17.0|2017-09-02 00:00:00|3|Saturday|AUTO|4|-58.49491054|-34.54795581|AV. GRAL. PAZ Y MACHAIN|PAZ, GRAL. AV. y MACHAIN|12
238|238|2017-0108|2017-09-02|2017|9|2|PASAJERO_ACOMPAÑANTE|AUTO|MASCULINO|10.0|2017-09-02 00:00:00|2|Saturday|AUTO|4|-58.49491054|-34.54795581|AV. GRAL. PAZ Y MACHAIN|PAZ, GRAL. AV. y MACHAIN|12
239|239|2017-0109|2017-09-04|2017|9|4|CONDUCTOR|MOTO|MASCULINO|21.0|2017-09-05 00:00:00|4|Monday|AUTO|21|-58.47130269|-34.63665402|AV. DIRECTORIO Y PORTELA|DIRECTORIO AV. y PORTELA|7
240|240|2017-0110|2017-09-06|2017|9|6|PEATON|PEATON|MASCULINO|56.0|2017-09-07 00:00:00|5|Wednesday|PASAJEROS|14|-58.370488|-34.60189492|LAVALLE Y AV. LEANDRO N ALEM|LAVALLE y ALEM, LEANDRO N. AV.|1
241|241|2017-0111|2017-09-07|2017|9|7|PEATON|PEATON|FEMENINO|79.0|2017-09-07 00:00:00|6|Thursday|CARGAS|18|-58.42023854|-34.6423411|USPALLATA Y PIROVANO|USPALLATA y PIROVANO|4
242|242|2017-0112|2017-09-10|2017|9|10|PASAJERO_ACOMPAÑANTE|AUTO|MASCULINO|1.0|SD|1|Sunday|OBJETO FIJO|9|-58.45807401|-34.6399743|AU 25 DE MAYO Y AV. VARELA|AUTOPISTA 25 DE MAYO y VARELA AV.|7
243|243|2017-0112|2017-09-10|2017|9|10|PASAJERO_ACOMPAÑANTE|AUTO|MASCULINO||2017-09-13 00:00:00|6|Sunday|OBJETO FIJO|9|-58.45807401|-34.6399743|AU 25 DE MAYO Y AV. VARELA|AUTOPISTA 25 DE MAYO y VARELA AV.|7
244|244|2017-0113|2017-09-11|2017|9|11|PEATON|PEATON|FEMENINO|76.0|2017-09-11 00:00:00|6|Monday|PASAJEROS|6|-58.37697717|-34.59573848|AV. SANTA FE Y MAIPU|SANTA FE AV. y MAIPU|1
245|245|2017-0114|2017-09-15|2017|9|15|CONDUCTOR|AUTO|MASCULINO|26.0|2017-09-15 00:00:00|4|Friday|OBJETO FIJO|2|-58.3910058|-34.5849866|AV. ALVEAR Y AV. DEL LIBERTADOR|ALVEAR AV. y DEL LIBERTADOR AV.|2
246|246|2017-0115|2017-09-19|2017|9|19|CONDUCTOR|MOTO|MASCULINO|34.0|SD|5|Tuesday|BICICLETA|18|-58.42182126|-34.63089661|AV. PAVON Y TREINTA Y TRES ORIENTALES|PAVON AV. y TREINTA Y TRES ORIENTALES|5
247|247|2017-0116|2017-09-20|2017|9|20|CONDUCTOR|MOTO|MASCULINO|22.0|2017-09-20 00:00:00|4|Wednesday|OBJETO FIJO|22|-58.51389422|-34.58075791|COLECTORA AV. GRAL. PAZ 5750|PAZ, GRAL. AV. 5750|12
248|248|2017-0118|2017-09-22|2017|9|22|PASAJERO_ACOMPAÑANTE|MOTO|FEMENINO|26.0|2017-09-29 00:00:00|4|Friday|AUTO|7|-58.37585415|-34.65232158|VIEYTES Y CRUZ|VIEYTES y CRUZ, OSVALDO AV.|4
249|249|2017-0120|2017-10-02|2017|10|2|CONDUCTOR|MOTO|MASCULINO|20.0|2017-10-02 00:00:00|4|Monday|CARGAS|15|-58.47297505|-34.66245085|AU DELLEPIANE Y AV. ESCALADA|AUTOPISTA DELLEPIANE LUIS TTE. GRAL. y ESCALADA AV.|9
250|250|2017-0123|2017-10-10|2017|10|10|PEATON|PEATON|FEMENINO|36.0|2017-10-10 00:00:00|5|Tuesday|AUTO|1|-58.46855503|-34.67216349|ALBARIÑO Y AV. ARGENTINA|ALBARIÃ‘O y ARGENTINA AV.|8
251|251|2017-0124|2017-10-12|2017|10|12|CONDUCTOR|MOTO|MASCULINO|51.0|2017-10-12 00:00:00|5|Thursday|PASAJEROS|14|-58.44254033|-34.59185043|JUAN RAMIREZ DE VELAZCO 1211|RAMIREZ DE VELASCO, JUAN 1211|15
252|252|2017-0125|2017-10-13|2017|10|13|CONDUCTOR|MOTO|MASCULINO|29.0|2017-10-13 00:00:00|4|Friday|OBJETO FIJO|6|-58.46622247|-34.67926929|AV. FERNANDEZ DE LA CRUZ Y LARRAYA|FERNANDEZ DE LA CRUZ, F., GRAL. AV. y LARRAYA|8
253|253|2017-0126|2017-10-14|2017|10|14|PASAJERO_ACOMPAÑANTE|AUTO|MASCULINO|39.0|SD|5|Saturday|OBJETO FIJO|6|-58.48003734|-34.68148508|AV. RIESTRA Y CAÑADA DE GOMEZ|RIESTRA AV. y CAÃ‘ADA DE GOMEZ|8
254|254|2017-0126|2017-10-14|2017|10|14|CONDUCTOR|AUTO|MASCULINO|36.0|2017-10-14 00:00:00|5|Saturday|OBJETO FIJO|6|-58.48003734|-34.68148508|AV. RIESTRA Y CAÑADA DE GOMEZ|RIESTRA AV. y CAÃ‘ADA DE GOMEZ|8
255|255|2017-0127|2017-10-16|2017|10|16|PASAJERO_ACOMPAÑANTE|MOTO|MASCULINO|24.0|2017-10-16 00:00:00|4|Monday|MOTO|7|-58.41192137|-34.59800248|GALLO Y AV. CORDOBA|GALLO y CORDOBA AV.|2
256|256|2017-0128|2017-10-17|2017|10|17|PEATON|PEATON|FEMENINO|60.0|2017-10-17 00:00:00|6|Tuesday|PASAJEROS|12|-58.44034689|-34.61349731|DR. JUAN F. ARANGUREN 611|ARANGUREN, JUAN F., DR. 611|6
257|257|2017-0129|2017-10-26|2017|10|26|CONDUCTOR|MOTO|MASCULINO|57.0|2017-10-26 00:00:00|5|Thursday|PASAJEROS|19|-58.47155277|-34.64925746|AU PERITO MORENO Y AU 25 DE MAYO|AUTOPISTA PERITO MORENO y AUTOPISTA 25 DE MAYO|9
258|258|2017-0130|2017-10-27|2017|10|27|CONDUCTOR|AUTO|MASCULINO|23.0|2017-10-27 00:00:00|4|Friday|CARGAS|5|-58.47883099|-34.59967065|CHORROARIN Y AV. SAN MARTIN|CHORROARIN y SAN MARTIN AV.|15
259|259|2017-0132|2017-10-30|2017|10|30|CONDUCTOR|MOTO|MASCULINO|23.0|2017-10-30 00:00:00|4|Monday|PASAJEROS|14|-58.46552171|-34.6937413|COSQUIN Y AV. CNEL. ROCA|COSQUIN y ROCA, CNEL. AV.|8
260|260|2017-0134|2017-11-06|2017|11|6|PEATON|PEATON|FEMENINO|47.0|2017-11-06 00:00:00|5|Monday|PASAJEROS|18|-58.4423972|-34.66777987|AV. CNEL. ROCA 3555|ROCA, CNEL. AV. 3555|8
261|261|2017-0135|2017-11-07|2017|11|7|CONDUCTOR|MOTO|MASCULINO|24.0|2017-11-07 00:00:00|4|Tuesday|CARGAS|12|-58.47032551|-34.59626814|AV. WARNES Y PUNTA ARENAS|WARNES AV. y PUNTA ARENAS|15
262|262|2017-0136|2017-11-16|2017|11|16|PEATON|PEATON|MASCULINO|55.0|2017-11-16 00:00:00|5|Thursday|PASAJEROS|8|-58.41827843|-34.65522746|DEL BARCO CENTENERA Y RABANAL|BARCO CENTENERA DEL y RABANAL, FRANCISCO, INTENDENTE AV.|4
263|263|2017-0137|2017-11-17|2017|11|17|PEATON|PEATON|FEMENINO|60.0|2017-11-17 00:00:00|6|Friday|CARGAS|11|-58.51280715|-34.59279388|AV. GRAL. ENRIQUE MOSCONI Y SAN NICOLAS|MOSCONI GENERAL AV. y SAN NICOLAS|11
264|264|2017-0138|2017-11-19|2017|11|19|PASAJERO_ACOMPAÑANTE|MOTO|MASCULINO|25.0|2017-11-19 00:00:00|4|Sunday|OBJETO FIJO|10|-58.46258582|-34.64385704|AV. LAFUENTE Y AV. EVA PERON|LAFUENTE AV. y PERON, EVA AV.|7
265|265|2017-0139|2017-11-19|2017|11|19|PASAJERO_ACOMPAÑANTE|AUTO|FEMENINO|15.0|2017-11-19 00:00:00|3|Sunday|OBJETO FIJO|22|-58.45064148|-34.68003614|AV. CNEL. ROCA Y AV. ESCALADA|ROCA, CNEL. AV. y ESCALADA AV.|8
266|266|2017-0140|2017-11-19|2017|11|19|CONDUCTOR|MOTO|MASCULINO|24.0|2017-11-19 00:00:00|4|Sunday|PASAJEROS|23|0.0|0.0|AU ARTURO FRONDIZI PKM 3100|AUTOPISTA 1 SUR PRESIDENTE ARTURO FRONDIZI|4
