|Unnamed: 0|id|fecha|anio|mes|dia|rol|victima|sexo|edad|fecha_deceso|edad_rango|dia_semana|acusado|hora_rango|x|y|lugar|direc_norm|comuna
527|527|2019-0092|2019-11-03|2019|11|3|PEATON|PEATON|MASCULINO|37.0|2019-11-03 00:00:00|5|Sunday|PASAJEROS|10|-58.35608181|-34.63420319|BRIN, MINISTRO Y SUAREZ|BRIN, MINISTRO y SUAREZ|4
528|528|2019-0093|2019-11-13|2019|11|13|CICLISTA|BICICLETA|MASCULINO|16.0|2019-11-13 00:00:00|3|Wednesday|OTRO|11|-58.46483679|-34.60907662|NIZA Y JUSTO, JUAN B. AV.|NIZA y JUSTO, JUAN B. AV.|11
529|529|2019-0094|2019-11-18|2019|11|18|PASAJERO_ACOMPAÑANTE|MOTO|FEMENINO||2019-11-18 00:00:00|6|Monday|OTRO|14|-58.44368628|-34.59724326|CAMARGO Y SERRANO|CAMARGO y SERRANO|15
530|530|2019-0095|2019-11-20|2019|11|20|CONDUCTOR|MOTO|MASCULINO||2019-11-20 00:00:00|6|Wednesday|CARGAS|15|-58.37864583|-34.62907067|AUTOPISTA 1 SUR PRESIDENTE ARTURO FRONDIZI ALTURA CASEROS AV.|AUTOPISTA 1 SUR PRESIDENTE ARTURO FRONDIZI y CASEROS AV.|1
531|531|2019-0096|2019-11-22|2019|11|22|PEATON|PEATON|MASCULINO|73.0|2019-11-22 00:00:00|6|Friday|PASAJEROS|19|-58.37560352|-34.62726382|CASEROS AV. Y PIEDRAS|CASEROS AV. y PIEDRAS|1
532|532|2019-0097|2019-11-25|2019|11|25|PASAJERO_ACOMPAÑANTE|MOTO|FEMENINO|23.0|2019-11-25 00:00:00|4|Monday|MULTIPLE|8|-58.47721439|-34.64815069|AUTOPISTA PERITO MORENO KM 5,6|AUTOPISTA PERITO MORENO KM. 5.6|9
533|533|2019-0098|2019-11-25|2019|11|25|PASAJERO_ACOMPAÑANTE|PASAJEROS|FEMENINO|61.0|2019-11-29 00:00:00|6|Monday|PASAJEROS|14|-58.45134029|-34.58984288|GUZMAN 365|GUZMAN 365|15
534|534|2019-0100|2019-12-05|2019|12|5|CONDUCTOR|MOTO|MASCULINO|38.0|2019-12-18 00:00:00|5|Thursday|AUTO|17|-58.49040794|-34.58368803|de los constituyentes av. 4300|DE LOS CONSTITUYENTES AV. 4300|12
535|535|2019-0101|2019-12-17|2019|12|17|CONDUCTOR|MOTO|MASCULINO|25.0|2019-12-17 00:00:00|4|Tuesday|MOTO|4|-58.42102679|-34.64991178|MORENO, PERITO AV. Y TILCARA AV.|MORENO, PERITO AV. y TILCARA AV.|4
536|536|2019-0102|2019-12-17|2019|12|17|CONDUCTOR|MOTO|MASCULINO|18.0|2019-12-18 00:00:00|4|Tuesday|AUTO|14|-58.52219407|-34.64143926|IBARROLA Y GORDILLO, TIMOTEO|IBARROLA y GORDILLO, TIMOTEO|9
537|537|2019-0103|2019-12-18|2019|12|18|CONDUCTOR|MOTO|MASCULINO|24.0|2019-12-18 00:00:00|4|Wednesday|MOTO|7|-58.52169422|-34.5947164|PAZ, GRAL. AV. Y GRIVEO|PAZ, GRAL. AV. y GRIVEO|11
538|538|2019-0104|2019-12-21|2019|12|21|PASAJERO_ACOMPAÑANTE|MOTO|FEMENINO|23.0|2019-12-22 00:00:00|4|Saturday|AUTO|4|-58.47460416|-34.63206174|RIVADAVIA AV. Y PERGAMINO|RIVADAVIA AV. y PERGAMINO|10
539|539|2020-0001|2020-01-04|2020|1|4|PEATON|PEATON|FEMENINO|87.0|2020-01-04 00:00:00|6|Saturday|AUTO|10|-58.43910409|-34.59213355|URIARTE Y LOYOLA|URIARTE y LOYOLA|15
540|540|2020-0002|2020-01-05|2020|1|5|CONDUCTOR|MOTO|MASCULINO|36.0|2020-01-07 00:00:00|5|Sunday|OBJETO FIJO|20|-58.45019436|-34.64646409|SARAZA Y VARELA AV.|SARAZA y VARELA AV.|7
541|541|2020-0003|2020-01-11|2020|1|11|PEATON|PEATON|MASCULINO|44.0|2020-01-11 00:00:00|5|Saturday|AUTO|6|-58.39337644|-34.60927582|RIVADAVIA AV. Y COMBATE DE LOS POZOS|RIVADAVIA AV. y COMBATE DE LOS POZOS|3
542|542|2020-0004|2020-01-14|2020|1|14|PEATON|PEATON|MASCULINO|82.0|2020-01-15 00:00:00|6|Tuesday|PASAJEROS|21|-58.39055614|-34.60919284|RODRIGUEZ PEÑA Y RIVADAVIA AV.|RODRIGUEZ PEÃ‘A y RIVADAVIA AV.|1
543|543|2020-0005|2020-01-14|2020|1|14|CONDUCTOR|MOTO|MASCULINO|25.0|2020-02-10 00:00:00|4|Tuesday|PASAJEROS|6|-58.41036975|-34.62477021|24 DE NOVIEMBRE Y SAN JUAN AV.|24 DE NOVIEMBRE y SAN JUAN AV.|3
544|544|2020-0006|2020-01-20|2020|1|20|CONDUCTOR|MOTO|MASCULINO|23.0|2020-01-20 00:00:00|4|Monday|CARGAS|12|-58.44925765|-34.65412546|LAFUENTE AV. 2250|LAFUENTE AV. 2250|8
545|545|2020-0007|2020-01-27|2020|1|27|PEATON|PEATON|MASCULINO|52.0|2020-01-27 00:00:00|5|Monday|MOTO|0|-58.3815685|-34.61648696|CHILE Y LIMA |CHILE y LIMA|1
546|546|2020-0008|2020-01-30|2020|1|30|CONDUCTOR|MOTO|MASCULINO|49.0|2020-01-30 00:00:00|5|Thursday|CARGAS|7|-58.40662899|-34.59804521|CORDOBA AV. Y JEAN JAURES|CORDOBA AV. y JAURES, JEAN|2
547|547|2020-0009|2020-02-04|2020|2|4|PEATON|PEATON|MASCULINO|48.0|2020-02-05 00:00:00|5|Tuesday|AUTO|14|-58.41985649|-34.6060085|PERON, JUAN DOMINGO, TTE. GENERAL Y SALGUERO, JERONIMO|PERON, JUAN DOMINGO, TTE. GENERAL y SALGUERO, JERONIMO|5
548|548|2020-0010|2020-02-08|2020|2|8|CONDUCTOR|MOTO|MASCULINO||2020-02-08 00:00:00|6|Saturday|OBJETO FIJO|5|-58.38099833|-34.62214953|9 DE JULIO AV. Y SAN JUAN AV.|9 DE JULIO AV. y SAN JUAN AV.|1
549|549|2020-0011|2020-02-12|2020|2|12|CONDUCTOR|MOTO|MASCULINO|31.0|2020-02-12 00:00:00|5|Wednesday|CARGAS|11|-58.41803309|-34.61823178|COLOMBRES 466|COLOMBRES 466|5
550|550|2020-0012|2020-02-18|2020|2|18|PEATON|PEATON|FEMENINO|66.0|2020-02-18 00:00:00|6|Tuesday|MOTO|21|-58.40604003|-34.61783553|MEXICO 2860|MEXICO 2860|3
551|551|2020-0013|2020-02-20|2020|2|20|PEATON|PEATON|FEMENINO|58.0|2020-03-03 00:00:00|5|Thursday|MOTO|12|-58.47549929|-34.57994061|COMBATIENTES DE MALVINAS AV. Y TRIUNVITARO AV.|COMBATIENTES DE MALVINAS AV. y TRIUNVIRATO AV.|15
552|552|2020-0014|2020-02-27|2020|2|27|CONDUCTOR|MOTO|MASCULINO||2020-02-27 00:00:00|6|Thursday|PASAJEROS|2|-58.51398484|-34.61600366|BERMUDEZ Y NOGOYA|BERMUDEZ y NOGOYA|11
553|553|2020-0015|2020-02-28|2020|2|28|CONDUCTOR|MOTO|MASCULINO|29.0|2020-02-28 00:00:00|4|Friday|PASAJEROS|14|-58.36797542|-34.62519403|BRASIL AV. Y PASEO COLON AV.|BRASIL AV. y PASEO COLON AV.|1
554|554|2020-0016|2020-02-29|2020|2|29|PEATON|PEATON|MASCULINO|68.0|2020-03-09 00:00:00|6|Saturday|PASAJEROS|13|-58.37133616|-34.59879316|ALEM,LEANDRO N. AV. 770|ALEM, LEANDRO N. AV. 770|1
555|555|2020-0017|2020-03-05|2020|3|5|PEATON|PEATON|MASCULINO||2020-03-05 00:00:00|6|Thursday|AUTO|23|-58.39613805|-34.61413568|BELGRANO AV. Y RINCON|BELGRANO AV. y RINCON|3
556|556|2020-0018|2020-03-09|2020|3|9|CONDUCTOR|MOTO|MASCULINO|31.0|2020-03-09 00:00:00|5|Monday|OBJETO FIJO|14|-58.44903073|-34.54200276|UDAONDO, GUILLERMO AV. 901|UDAONDO, GUILLERMO AV. 901|13
557|557|2020-0019|2020-03-10|2020|3|10|PEATON|PEATON|FEMENINO|80.0|2020-03-10 00:00:00|6|Tuesday|AUTO|21|-58.41972364|-34.6284667|CONSTITUCION Y CASTRO|CONSTITUCION y CASTRO|5
558|558|2020-0020|2020-03-13|2020|3|13|PEATON|PEATON|FEMENINO|74.0|2020-03-17 00:00:00|6|Friday|MOTO|17|-58.40571596|-34.60557123|PUEYRREDON AV. Y GOMEZ, VALENTIN|PUEYRREDON AV. y GOMEZ, VALENTIN|3
559|559|2020-0021|2020-03-14|2020|3|14|PEATON|PEATON|FEMENINO|87.0|2020-03-14 00:00:00|6|Saturday|AUTO|16|-58.4145159|-34.59488319|BRAVO, MARIO 1279|BRAVO, MARIO 1279|2
560|560|2020-0022|2020-04-07|2020|4|7|PASAJERO_ACOMPAÑANTE|AUTO|MASCULINO|44.0|2020-04-07 00:00:00|5|Tuesday|CARGAS|6|-58.47297505|-34.66245085|DELLEPIANE, LUIS, TTE. GRAL. Y ESCALADA AV.|AUTOPISTA DELLEPIANE LUIS TTE. GRAL. y ESCALADA AV.|9
561|561|2020-0023|2020-04-09|2020|4|9|CONDUCTOR|AUTO|MASCULINO|44.0|2020-05-03 00:00:00|5|Thursday|CARGAS|18|-58.35791192|-34.63695178|ARAOZ DE LAMADRID, GREGORIO, GRAL. Y BROWN, ALTE. AV.|ARAOZ DE LAMADRID, GREGORIO, GRAL. y BROWN, ALTE. AV.|4
562|562|2020-0024|2020-04-24|2020|4|24|CONDUCTOR|AUTO|MASCULINO|53.0|2020-04-24 00:00:00|5|Friday|AUTO|7|-58.50801713|-34.65177305|MURGUIONDO 1339|MURGUIONDO 1339|9
563|563|2020-0025|2020-05-12|2020|5|12|PEATON|PEATON|MASCULINO||2020-05-12 00:00:00|6|Tuesday|AUTO|5|-58.40258477|-34.60975108|RIVADAVIA AV. 2551|RIVADAVIA AV. 2551|3
564|564|2020-0026|2020-05-17|2020|5|17|CONDUCTOR|MOTO|MASCULINO|28.0|2020-05-17 00:00:00|4|Sunday|OBJETO FIJO|6|0.0|0.0|LUGONES, LEOPOLDO AV. KM 6,1||14
565|565|2020-0027|2020-05-18|2020|5|18|PEATON|PEATON|MASCULINO|76.0|2020-05-18 00:00:00|6|Monday|CARGAS|8|-58.48267426|-34.68454456|DELLEPIANE, LUIS, TTE. GRAL. Y MONTIEL|DELLEPIANE, LUIS, TTE. GRAL. y MONTIEL|8
566|566|2020-0028|2020-05-19|2020|5|19|PEATON|PEATON|MASCULINO|91.0|2020-05-23 00:00:00|6|Tuesday|PASAJEROS|10|-58.44248936|-34.60221948|SCALABRINI ORTIZ, RAUL AV. Y WARNES AV.|SCALABRINI ORTIZ, RAUL AV. y WARNES AV.|15
567|567|2020-0029|2020-06-10|2020|6|10|PEATON|PEATON|MASCULINO|80.0|2020-06-12 00:00:00|6|Wednesday|PASAJEROS|14|-58.52909134|-34.63886726|PAZ, GRAL. AV. y ROFFO, ANGEL H., DR.|PAZ, GRAL. AV. y ROFFO, ANGEL H., DR.|9
568|568|2020-0030|2020-06-16|2020|6|16|CONDUCTOR|MOTO|MASCULINO|40.0|2020-06-16 00:00:00|5|Tuesday|MULTIPLE|15|-58.45158942|-34.6064658|SAN MARTIN AV. 1550|SAN MARTIN AV. 1550|6
569|569|2020-0031|2020-06-30|2020|6|30|CONDUCTOR|MOTO|MASCULINO|29.0|2020-06-30 00:00:00|4|Tuesday|CARGAS|8|-58.49344309|-34.65788529|GARZON, EUGENIO, GRAL. AV. y LARRAYA|GARZON, EUGENIO, GRAL. AV. y LARRAYA|9
570|570|2020-0032|2020-07-10|2020|7|10|CONDUCTOR|MOTO|MASCULINO|21.0|2020-07-10 00:00:00|4|Friday|AUTO|23|-58.44259166|-34.59635137|CORRIENTES AV. Y SERRANO|CORRIENTES AV. y SERRANO|15
571|571|2020-0033|2020-07-19|2020|7|19|CONDUCTOR|AUTO|MASCULINO|32.0|2020-07-19 00:00:00|5|Sunday|OBJETO FIJO|6|-58.46743471|-34.53476874|PAZ, GRAL. AV. Y DEL LIBERTADOR AV.|PAZ, GRAL. AV. y DEL LIBERTADOR AV.|13
572|572|2020-0034|2020-08-02|2020|8|2|PEATON|PEATON|FEMENINO||2020-08-02 00:00:00|6|Sunday|AUTO|3|-58.41178158|-34.60922259|MITRE, BARTOLOME Y ANCHORENA, TOMAS MANUEL DE, DR.|MITRE, BARTOLOME y ANCHORENA, TOMAS MANUEL DE, DR.|3
573|573|2020-0035|2020-08-04|2020|8|4|CONDUCTOR|MOTO|MASCULINO|40.0|2020-08-04 00:00:00|5|Tuesday|PASAJEROS|5|-58.45068621|-34.63638927|AU 25 DE MAYO ALTURA PUMACAHUA Y RECUERO, CASIMIRO, TTE. CNEL.|AUTOPISTA 25 DE MAYO y PUMACAHUA|7
574|574|2020-0036|2020-08-07|2020|8|7|PEATON|PEATON|MASCULINO|72.0|2020-08-22 00:00:00|6|Friday|MOTO|18|-58.42016954|-34.5877879|SCALABRINI ORTIZ, RAUL AV. Y PARAGUAY|SCALABRINI ORTIZ, RAUL AV. y PARAGUAY|14
575|575|2020-0037|2020-08-29|2020|8|29|PEATON|PEATON|MASCULINO|38.0|2020-08-29 00:00:00|5|Saturday|AUTO|4|-58.43850413|-34.65554754|FERNANDEZ DE LA CRUZ, F., GRAL. AV. Y VARELA AV.|FERNANDEZ DE LA CRUZ, F., GRAL. AV. y VARELA AV.|8
576|576|2020-0038|2020-08-30|2020|8|30|CONDUCTOR|AUTO|MASCULINO|46.0|2020-08-30 00:00:00|5|Sunday|AUTO|4|-58.40617526|-34.58345898|LAS HERAS GENERAL AV. Y DIAZ, CNEL. AV.|LAS HERAS GENERAL AV. y DIAZ, CNEL. AV.|14
577|577|2020-0038|2020-08-30|2020|8|30|CONDUCTOR|AUTO|MASCULINO|64.0|2020-08-30 00:00:00|6|Sunday|AUTO|4|-58.40617526|-34.58345898|LAS HERAS GENERAL AV. Y DIAZ, CNEL. AV.|LAS HERAS GENERAL AV. y DIAZ, CNEL. AV.|14
578|578|2020-0039|2020-09-01|2020|9|1|PEATON|PEATON|MASCULINO|44.0|2020-09-01 00:00:00|5|Tuesday|CARGAS|19|0.0|0.0|MURGUIONDO 2700|MURGUIONDO|9
579|579|2020-0040|2020-09-12|2020|9|12|CONDUCTOR|AUTO|MASCULINO||2020-09-12 00:00:00|6|Saturday|OBJETO FIJO|3|-58.38526125|-34.5780581|CASTILLO, RAMON S., PRES. AV. Y CALLE 12|CASTILLO, RAMON S., PRES. AV. y CALLE 12 (NO OFICIAL)|2
580|580|2020-0041|2020-09-28|2020|9|28|CONDUCTOR|MOTO|MASCULINO|34.0|2020-09-28 00:00:00|5|Monday|PASAJEROS|1|-58.4475047|-34.63491705|CURAPALIGUE Y PERON, EVA AV.|CURAPALIGUE y PERON, EVA AV.|7
581|581|2020-0042|2020-09-29|2020|9|29|PEATON|PEATON|FEMENINO|53.0|2020-09-29 00:00:00|5|Tuesday|PASAJEROS|17|-58.46745752|-34.68192648|DIAZ, ANA Y SOLDADO DE LA FRONTERA AV.|DIAZ, ANA y SOLDADO DE LA FRONTERA AV.|8
582|582|2020-0043|2020-09-30|2020|9|30|PEATON|PEATON|MASCULINO|64.0|2020-09-30 00:00:00|6|Wednesday|PASAJEROS|17|-58.37202621|-34.59717942|ALEM, LEANDRO N. AV. Y PARAGUAY|ALEM, LEANDRO N. AV. y PARAGUAY|1
583|583|2020-0044|2020-10-05|2020|10|5|CONDUCTOR|AUTO|MASCULINO|43.0|2020-10-05 00:00:00|5|Monday|AUTO|0|-58.42779702|-34.62207347|LA PLATA AV. E INDEPENDENCIA|LA PLATA AV. e INDEPENDENCIA AV.|6
584|584|2020-0045|2020-10-19|2020|10|19|CONDUCTOR|AUTO|MASCULINO|50.0|2020-10-19 00:00:00|5|Monday|CARGAS|3|-58.46244952|-34.70524971|PAZ, GRAL. AV. Y 27 DE FEBRERO AV.|PAZ, GRAL. AV. y 27 DE FEBRERO AV.|8
585|585|2020-0046|2020-10-27|2020|10|27|CONDUCTOR|MOTO|MASCULINO|41.0|2020-10-27 00:00:00|5|Tuesday|MOTO|21|-58.4844016|-34.60776782|NAZCA AV. Y CARRANZA, ADOLFO P.|NAZCA AV. y CARRANZA, ADOLFO P.|11
586|586|2020-0047|2020-10-27|2020|10|27|PEATON|PEATON|MASCULINO|15.0|2020-10-27 00:00:00|3|Tuesday|CARGAS|14|-58.46668375|-34.65174801|AUTOPISTA CAMPORA ALTURA LACARRA AV.|AUTOPISTA PRESIDENTE HÃ‰CTOR J. CÃMPORA y LACARRA AV.|9
587|587|2020-0048|2020-10-29|2020|10|29|CONDUCTOR|MOTO|MASCULINO|41.0|2020-10-29 00:00:00|5|Thursday|OBJETO FIJO|20|-58.4495878|-34.59322448|DORREGO AV. 614|DORREGO AV. 614|15
588|588|2020-0049|2020-10-30|2020|10|30|PEATON|PEATON|MASCULINO|36.0|2020-10-30 00:00:00|5|Friday|AUTO|20|-58.37533517|-34.59276462|DEL LIBERTADOR AV. Y RAMOS MEJIA, JOSE MARIA, DR. AV.|DEL LIBERTADOR AV. y RAMOS MEJIA, JOSE MARIA, DR. AV.|1
589|589|2020-0050|2020-11-01|2020|11|1|PEATON|PEATON|FEMENINO|28.0|2020-11-01 00:00:00|4|Sunday|MOTO|22|-58.42525456|-34.57866344|SANTA FE AV. Y GODOY CRUZ|SANTA FE AV. y GODOY CRUZ|14
590|590|2020-0051|2020-11-05|2020|11|5|CONDUCTOR|MOTO|MASCULINO|49.0|2020-11-05 00:00:00|5|Thursday|AUTO|0|-58.48493828|-34.62981124|AVELLANEDA AV. Y MERCEDES|AVELLANEDA AV. y MERCEDES|10
591|591|2020-0052|2020-11-07|2020|11|7|CICLISTA|BICICLETA|MASCULINO|44.0|2020-11-07 00:00:00|5|Saturday|CARGAS|6|-58.40480504|-34.60183884|TUCUMAN Y PUEYRREDON AV.|TUCUMAN y PUEYRREDON AV.|3
592|592|2020-0053|2020-11-09|2020|11|9|PASAJERO_ACOMPAÑANTE|AUTO|MASCULINO|27.0|2020-11-09 00:00:00|4|Monday|AUTO|3|-58.41125934|-34.6541774|ALCORTA, AMANCIO AV. Y EINSTEIN, ALBERTO|ALCORTA, AMANCIO AV. y EINSTEIN, ALBERTO|4
593|593|2020-0054|2020-11-19|2020|11|19|CICLISTA|BICICLETA|MASCULINO|59.0|2020-11-23 00:00:00|5|Thursday|AUTO|9|-58.39956546|-34.6297708|INCLAN Y ALBERTI|INCLAN y ALBERTI|4
594|594|2020-0055|2020-11-19|2020|11|19|PEATON|PEATON|MASCULINO|91.0|2020-12-11 00:00:00|6|Thursday|CARGAS|12|-58.49005682|-34.5786897|OLAZABAL AV. 5437|OLAZABAL AV. 5437|12
595|595|2020-0056|2020-11-21|2020|11|21|CONDUCTOR|MOTO|FEMENINO|34.0|2020-11-21 00:00:00|5|Saturday|CARGAS|13|-58.47064556|-34.69843756|PAZ, GRAL. AV. Y DOCTOR RAMON CARRILLO|PAZ, GRAL. AV. y ROCA, CNEL. AV.|8
596|596|2020-0057|2020-11-23|2020|11|23|PEATON|PEATON|MASCULINO|84.0|2020-11-23 00:00:00|6|Monday|AUTO|7|-58.4750156|-34.61945902|NAZCA AV. Y VIALE, LUIS|NAZCA AV. y VIALE, LUIS|11
597|597|2020-0058|2020-11-24|2020|11|24|PEATON|PEATON|MASCULINO|57.0|2020-11-25 00:00:00|5|Tuesday|AUTO|16|-58.48727942|-34.63652467|OLIVERA AV. Y FALCON, RAMON L., CNEL.|OLIVERA AV. y FALCON, RAMON L.,CNEL.|10
598|598|2020-0059|2020-12-01|2020|12|1|PEATON|PEATON|FEMENINO|49.0|2020-12-14 00:00:00|5|Tuesday|PASAJEROS|6|-58.3795169|-34.62794241|BRASIL 1100|BRASIL 1100|1
599|599|2020-0060|2020-12-03|2020|12|3|PEATON|PEATON|FEMENINO|69.0|2020-12-03 00:00:00|6|Thursday|MOTO|20|-58.47750832|-34.65672199|HOMERO Y PERON, EVA AV.|HOMERO y PERON, EVA AV.|9
600|600|2020-0061|2020-12-03|2020|12|3|CONDUCTOR|MOTO|MASCULINO|45.0|2020-12-04 00:00:00|5|Thursday|CARGAS|14|-58.44927253|-34.54048625|CANTILO, INT. Y UDAONDO, GUILLERMO AV.|CANTILO, INT. y UDAONDO, GUILLERMO AV.|13
601|601|2020-0062|2020-12-04|2020|12|4|CICLISTA|BICICLETA|MASCULINO|47.0|2020-12-04 00:00:00|5|Friday|PASAJEROS|17|-58.39246272|-34.61253541|MORENO 1845|MORENO 1845|3
602|602|2020-0063|2020-12-05|2020|12|5|PEATON|PEATON|MASCULINO|38.0|2020-12-05 00:00:00|5|Saturday|MOTO|7|-58.52783814|-34.61047001|NUEVA YORK Y ALTA GRACIA|NUEVA YORK y ALTA GRACIA|11
603|603|2020-0063|2020-12-05|2020|12|5|PASAJERO_ACOMPAÑANTE|MOTO|MASCULINO|21.0|2020-12-05 00:00:00|4|Saturday|MOTO|7|-58.52783814|-34.61047001|NUEVA YORK Y ALTA GRACIA|NUEVA YORK y ALTA GRACIA|11
604|604|2020-0065|2020-12-05|2020|12|5|CONDUCTOR|MOTO|MASCULINO|24.0|2020-12-06 00:00:00|4|Saturday|AUTO|16|-58.49332664|-34.54836855|PAZ, GRAL. AV. Y GOYENECHE, ROBERTO PARQUE AV.|PAZ, GRAL. AV. y GOYENECHE, ROBERTO PARQUE AV.|12
605|605|2020-0066|2020-12-07|2020|12|7|CONDUCTOR|MOTO|MASCULINO|27.0|2020-12-07 00:00:00|4|Monday|OBJETO FIJO|4|-58.50178784|-34.63593897|AUTOPISTA PERITO MORENO ALTURA ESTACION DE TREN VILLA LURO|AUTOPISTA PERITO MORENO (ALTURA ESTACION DE TREN VILLA LURO)|10
606|606|2020-0067|2020-12-11|2020|12|11|PEATON|PEATON|MASCULINO|51.0|2020-12-11 00:00:00|5|Friday|PASAJEROS|22|-58.41657793|-34.65476216|SAENZ AV. Y BEAZLEY|SAENZ AV. y BEAZLEY|4
607|607|2020-0068|2020-12-12|2020|12|12|CONDUCTOR|MOTO|MASCULINO|71.0|2020-12-20 00:00:00|6|Saturday|AUTO|20|-58.39731474|-34.58307887|DEL LIBERTADOR AV. Y AUSTRIA|DEL LIBERTADOR AV. y AUSTRIA|2
608|608|2020-0069|2020-12-15|2020|12|15|PASAJERO_ACOMPAÑANTE|MOTO|MASCULINO|25.0|2020-12-15 00:00:00|4|Tuesday|PASAJEROS|5|-58.38746381|-34.61790839|INDEPENDENCIA AV. Y SAENZ PEÑA, LUIS, PRES.|INDEPENDENCIA AV. y SAENZ PEÃ‘A, LUIS, PRES.|1
609|609|2020-0070|2020-12-17|2020|12|17|PEATON|PEATON|FEMENINO|81.0|2020-12-22 00:00:00|6|Thursday|PASAJEROS|15|-58.39189441|-34.59176378|CALLAO AV. Y LAS HERAS, GENERAL|CALLAO AV. y LAS HERAS, GENERAL|2
610|610|2020-0071|2020-12-17|2020|12|17|PEATON|PEATON|MASCULINO|4.0|2020-12-17 00:00:00|1|Thursday|AUTO|23|-58.46749188|-34.63551751|SAN PEDRITO AV. Y DIRECTORIO AV.|SAN PEDRITO AV. y DIRECTORIO AV.|7
611|611|2020-0072|2020-12-19|2020|12|19|CICLISTA|BICICLETA|MASCULINO|42.0|2020-12-19 00:00:00|5|Saturday|AUTO|3|-58.40280471|-34.62113271|JUJUY AV. Y CARLOS, CALVO|JUJUY AV. y CALVO, CARLOS|3
612|612|2020-0073|2020-12-20|2020|12|20|CONDUCTOR|MOTO|MASCULINO|56.0|2020-12-20 00:00:00|5|Sunday|OBJETO FIJO|7|-58.44451316|-34.68475866|27 DE FEBRERO AV. Y ESCALADA AV.|27 DE FEBRERO AV. y ESCALADA AV.|8
613|613|2020-0074|2020-12-20|2020|12|20|CONDUCTOR|AUTO|MASCULINO|39.0|2020-12-20 00:00:00|5|Sunday|AUTO|21|-58.47110424|-34.62742408|BOGOTA Y NAZCA AV.|BOGOTA y NAZCA AV.|7
614|614|2020-0075|2020-12-23|2020|12|23|PEATON|PEATON|MASCULINO|23.0|2020-12-23 00:00:00|4|Wednesday|PASAJEROS|14|-58.38220928|-34.60373898|CORRIENTES AV. Y 9 DE JULIO AV.|CORRIENTES AV. y 9 DE JULIO AV.|1
615|615|2020-0076|2020-12-24|2020|12|24|CONDUCTOR|AUTO|FEMENINO|78.0|2021-01-17 00:00:00|6|Thursday|PASAJEROS|12|-58.49794468|-34.61565025|ALVAREZ JONTE AV. Y CHIVILCOY|ALVAREZ JONTE AV. y CHIVILCOY|10
616|616|2020-0077|2020-12-25|2020|12|25|CONDUCTOR|MOTO|FEMENINO|30.0|2020-12-25 00:00:00|5|Friday|AUTO|6|-58.47220945|-34.60111373|SAN MARTIN AV. Y PUNTA ARENAS|SAN MARTIN AV. y PUNTA ARENAS|15
617|617|2020-0077|2020-12-25|2020|12|25|PASAJERO_ACOMPAÑANTE|MOTO|FEMENINO|24.0|2020-12-25 00:00:00|4|Friday|AUTO|6|-58.47220945|-34.60111373|SAN MARTIN AV. Y PUNTA ARENAS|SAN MARTIN AV. y PUNTA ARENAS|15
618|618|2020-0078|2020-12-25|2020|12|25|CICLISTA|BICICLETA|MASCULINO|26.0|2020-12-25 00:00:00|4|Friday|PASAJEROS|5|-58.43706741|-34.63217813|BARCO CENTENERA DEL 1118|BARCO CENTENERA DEL 1118|7
619|619|2020-0079|2020-12-27|2020|12|27|CONDUCTOR|MOTO|MASCULINO|28.0|2020-12-27 00:00:00|4|Sunday|OBJETO FIJO|4|-58.49332664|-34.54836855|PAZ, GRAL. AV. Y ACCESO NORTE - PANAMERICANA|PAZ, GRAL. AV. y GOYENECHE, ROBERTO PARQUE AV.|12
620|620|2021-0001|2021-01-06|2021|1|6|CONDUCTOR|MOTO|MASCULINO|36.0|2021-01-06 00:00:00|5|Wednesday|AUTO|18|-58.37960727|-34.62622851|AU FRONDIZI KM. 3|AU FRONDIZI KM. 3|1
621|621|2021-0002|2021-01-07|2021|1|7|CONDUCTOR|MOTO|FEMENINO|47.0|2021-01-07 00:00:00|5|Thursday|CARGAS|10|-58.51061062|-34.64972472|CASTRO, EMILIO AV. Y MURGUIONDO|CASTRO, EMILIO AV. y MURGUIONDO|9
622|622|2021-0003|2021-01-10|2021|1|10|CONDUCTOR|MOTO|MASCULINO|27.0|2021-01-10 00:00:00|4|Sunday|OBJETO FIJO|7|-58.43052224|-34.62941648|AU 25 DE MAYO KM. 3,7|AUTOPISTA 25 DE MAYO KM. 3.7|7
623|623|2021-0004|2021-01-11|2021|1|11|PEATON|PEATON|FEMENINO|61.0|2021-01-11 00:00:00|6|Monday|CARGAS|9|-58.41455544|-34.63866836|CASEROS AV. Y GUARANI|CASEROS AV. y GUARANI|5
624|624|2021-0005|2021-01-11|2021|1|11|PEATON|PEATON|MASCULINO|73.0|2021-01-14 00:00:00|6|Monday|AUTO|21|-58.46774439|-34.64730145|PERON, EVA AV. 3800|PERON, EVA AV. 3800|9
625|625|2021-0006|2021-01-12|2021|1|12|PASAJERO_ACOMPAÑANTE|MOTO|FEMENINO|23.0|2021-01-12 00:00:00|4|Tuesday|CARGAS|21|-58.40786274|-34.56726817|AU ILLIA y SARMIENTO AV.|AUTOPISTA ARTURO ILLIA y SARMIENTO AV.|14
626|626|2021-0007|2021-01-18|2021|1|18|CONDUCTOR|MOTO|MASCULINO|84.0|2021-01-26 00:00:00|6|Monday|MOTO|10|-58.48744301|-34.58622275|DE LOS CONSTITUYENTES AV. Y GIRIBONE|DE LOS CONSTITUYENTES AV. y GIRIBONE|15
627|627|2021-0008|2021-01-22|2021|1|22|PEATON|PEATON|MASCULINO|28.0|2021-01-22 00:00:00|4|Friday|PASAJEROS|23|-58.41657793|-34.65476216|SAENZ AV. Y RABANAL, FRANCISCO, INTENDENTE AV.|SAENZ AV. y RABANAL, FRANCISCO, INTENDENTE AV.|4
628|628|2021-0009|2021-01-23|2021|1|23|CONDUCTOR|MOTO|MASCULINO|31.0|2021-01-23 00:00:00|5|Saturday|OBJETO FIJO|5|-58.45351111|-34.61134937|PAYSANDU Y GAONA|PAYSANDU y GAONA AV.|6
629|629|2021-0010|2021-01-23|2021|1|23|CONDUCTOR|MOTO|MASCULINO|28.0|2021-01-23 00:00:00|4|Saturday|AUTO|8|-58.5007381|-34.5497951|PAZ, GRAL. AV. Y BALBIN, RICARDO, DR. AV. |PAZ, GRAL. AV. y BALBIN, RICARDO, DR. AV.|12
630|630|2021-0011|2021-01-27|2021|1|27|PEATON|PEATON|MASCULINO|21.0|2021-01-27 00:00:00|4|Wednesday|AUTO|1|-58.39144148|-34.59564871|SANTA FE AV. 1675|SANTA FE AV. 1675|2
631|631|2021-0012|2021-01-29|2021|1|29|PEATON|PEATON|MASCULINO||2021-01-29 00:00:00|6|Friday|AUTO|20|-58.48191128|-34.68385968|AU DELLEPIANE Y GUAMINI|DELLEPIANE, LUIS, TTE. GRAL. y GUAMINI|8
632|632|2021-0013|2021-01-31|2021|1|31|CONDUCTOR|MOTO|MASCULINO|41.0|2021-01-31 00:00:00|5|Sunday|OBJETO FIJO|6|-58.48727942|-34.63652467|FALCON, RAMON L., CNEL. Y OLIVERA AV.|FALCON, RAMON L.,CNEL. y OLIVERA AV.|10
633|633|2021-0014|2021-02-02|2021|2|2|PEATON|PEATON|MASCULINO|28.0|2021-02-18 00:00:00|4|Tuesday|AUTO|0|-58.48328708|-34.59779521|SAN MARTIN AV. Y NOGOYA|SAN MARTIN AV. y NOGOYA|15
634|634|2021-0015|2021-02-06|2021|2|6|CONDUCTOR|MOTO|MASCULINO|26.0|2021-02-06 00:00:00|4|Saturday|OBJETO FIJO|3|-58.49018543|-34.5972499|SAN MARTIN AV. Y TINOGASTA|SAN MARTIN AV. y TINOGASTA|15
635|635|2021-0016|2021-02-14|2021|2|14|CONDUCTOR|AUTO|MASCULINO|22.0|2021-02-14 00:00:00|4|Sunday|OBJETO FIJO|5|-58.47230127|-34.68482689|FERNANDEZ DE LA CRUZ, F., GRAL. AV. Y DE LA TORRE, LISANDRO|FERNANDEZ DE LA CRUZ, F., GRAL. AV. y DE LA TORRE, LISANDRO|8
636|636|2021-0017|2021-02-17|2021|2|17|CONDUCTOR|MOTO|MASCULINO|33.0|2021-02-17 00:00:00|5|Wednesday|PASAJEROS|4|-58.38262614|-34.63168269|SALTA Y CASEROS AV.|SALTA y CASEROS AV.|1
637|637|2021-0018|2021-02-20|2021|2|20|PEATON|PEATON|MASCULINO|36.0|2021-03-08 00:00:00|5|Saturday|AUTO|19|-58.41047268|-34.60793518|JAURES, JEAN Y PERON, JUAN DOMINGO, TTE. GENERAL|JAURES, JEAN y PERON, JUAN DOMINGO, TTE. GENERAL|3
638|638|2021-0019|2021-02-21|2021|2|21|CONDUCTOR|MOTO|MASCULINO|30.0|2021-02-21 00:00:00|5|Sunday|OBJETO FIJO|1|-58.49659234|-34.56353635|TRIUNVIRATO AV. Y LARRALDE, CRISOLOGO AV.|TRIUNVIRATO AV. y LARRALDE, CRISOLOGO AV.|12
639|639|2021-0020|2021-02-21|2021|2|21|PEATON|PEATON|FEMENINO||2021-02-21 00:00:00|6|Sunday|CARGAS|15|-58.42462955|-34.60727189|POTOSI Y GASCON|POTOSI y GASCON|5
640|640|2021-0021|2021-02-26|2021|2|26|CONDUCTOR|MOTO|MASCULINO|39.0|2021-03-04 00:00:00|5|Friday|OBJETO FIJO|5|-58.41168345|-34.61185625|YRIGOYEN, HIPOLITO Y  24 DE NOVIEMBRE|YRIGOYEN, HIPOLITO y 24 DE NOVIEMBRE|3
641|641|2021-0022|2021-02-28|2021|2|28|PASAJERO_ACOMPAÑANTE|PASAJEROS|MASCULINO|68.0|2021-03-06 00:00:00|6|Sunday|SD|12|-58.45157681|-34.55217303|DEL LIBERTADOR AV. Y ROOSEVELT FRANKLIN D.|DEL LIBERTADOR AV. y ROOSEVELT FRANKLIN D.|13
642|642|2021-0023|2021-03-01|2021|3|1|CONDUCTOR|MOTO|MASCULINO|24.0|2021-03-01 00:00:00|4|Monday|CARGAS|9|0.0|0.0|AU BUENOS AIRES LA PLATA  KM 4,5||4
643|643|2021-0024|2021-03-03|2021|3|3|CICLISTA|BICICLETA|MASCULINO|5.0|2021-03-03 00:00:00|2|Wednesday|CARGAS|16|-58.49573651|-34.67006054|PERON, EVA AV. y PIEDRA BUENA AV|PERON, EVA AV. y PIEDRA BUENA AV.|9
644|644|2021-0025|2021-03-11|2021|3|11|CONDUCTOR|MOTO|MASCULINO|37.0|2021-03-11 00:00:00|5|Thursday|OTRO|3|-58.48695354|-34.68795245|PAZ, GRAL. AV. y DELLEPIANE, LUIS, TTE. GRAL|PAZ, GRAL. AV. y AUTOPISTA DELLEPIANE LUIS TTE. GRAL.|8
645|645|2021-0026|2021-03-15|2021|3|15|CONDUCTOR|MOTO|MASCULINO|36.0|2021-03-15 00:00:00|5|Monday|OBJETO FIJO|2|-58.37562539|-34.64449357|AU FRONDIZI ALTURA QUINQUELA MARTIN, BENITO|AUTOPISTA 1 SUR PRESIDENTE ARTURO FRONDIZI y QUINQUELA MARTIN, BENITO|4
646|646|2021-0027|2021-03-16|2021|3|16|CONDUCTOR|MOTO|FEMENINO|19.0|2021-03-16 00:00:00|4|Tuesday|CARGAS|15|-58.49491054|-34.54795581|PAZ, GRAL. AV. y DONADO|PAZ, GRAL. AV. y DONADO|12
647|647|2021-0028|2021-03-29|2021|3|29|PEATON|PEATON|MASCULINO||2021-03-29 00:00:00|6|Monday|PASAJEROS|17|-58.44147621|-34.64357704|COREA AV. y TORRES Y TENORIO, PRES|COREA AV. y TORRES Y TENORIO, PRES.|7
648|648|2021-0029|2021-03-31|2021|3|31|CONDUCTOR|AUTO|MASCULINO|26.0|2021-04-02 00:00:00|4|Wednesday|AUTO|18|-58.46899119|-34.63215432|FALCON, RAMON L., CNEL. Y SAN PEDRITO AV.|FALCON, RAMON L.,CNEL. y SAN PEDRITO AV.|7
649|649|2021-0030|2021-04-03|2021|4|3|PEATON|PEATON|MASCULINO|36.0|2021-04-07 00:00:00|5|Saturday|PASAJEROS|18|-58.38685612|-34.63455776|FINOCHIETTO ENRIQUE DR. 1623|FINOCHIETTO ENRIQUE DR. 1623|4
650|650|2021-0031|2021-04-07|2021|4|7|PEATON|PEATON|FEMENINO|68.0|2021-04-11 00:00:00|6|Wednesday|CARGAS|10|-58.38113667|-34.61765323|9 DE JULIO AV. E INDEPENDENCIA AV.|9 DE JULIO AV. e INDEPENDENCIA AV.|1
651|651|2021-0032|2021-04-10|2021|4|10|PEATON|PEATON|MASCULINO|60.0|2021-04-29 00:00:00|6|Saturday|MOTO|19|-58.44112678|-34.54538956|AU CANTILO Y GUIRALDES, INT.|CANTILO, INT. y GUIRALDES, INT.|13
652|652|2021-0033|2021-04-14|2021|4|14|CONDUCTOR|AUTO|MASCULINO|33.0|2021-04-14 00:00:00|5|Wednesday|OBJETO FIJO|17|-58.41595919|-34.62743346|AU 25 DE MAYO ALTURA BAJADA BOEDO AV.|AUTOPISTA 25 DE MAYO y BOEDO AV.|5
653|653|2021-0034|2021-04-19|2021|4|19|PASAJERO_ACOMPAÑANTE|MOTO|FEMENINO|26.0|2021-04-19 00:00:00|4|Monday|CARGAS|14|-58.40184094|-34.64546845|ALCORTA, AMANCIO AV. y ZAVALETA|ALCORTA, AMANCIO AV. y ZAVALETA|4
654|654|2021-0035|2021-05-03|2021|5|3|CONDUCTOR|MOTO|MASCULINO|24.0|2021-05-03 00:00:00|4|Monday|CARGAS|9|-58.44642231|-34.65679806|JANER, ANA MARIA Y LAFUENTE AV.|JANER, ANA MARIA y LAFUENTE AV.|8
655|655|2021-0036|2021-05-09|2021|5|9|CONDUCTOR|MOTO|MASCULINO|36.0|2021-05-09 00:00:00|5|Sunday|OBJETO FIJO|6|-58.52340614|-34.59798754|PAZ, GRAL. AV. Y MOSCONI GENERAL AV.|PAZ, GRAL. AV. y MOSCONI GENERAL AV.|11
