|Unnamed: 0|id|fecha|anio|mes|dia|rol|victima|sexo|edad|fecha_deceso|edad_rango|dia_semana|acusado|hora_rango|x|y|lugar|direc_norm|comuna
267|267|2017-0141|2017-11-23|2017|11|23|PEATON|PEATON|FEMENINO|22.0|2017-11-23 00:00:00|4|Thursday|PASAJEROS|19|-58.42717783|-34.62513374|AV. LA PLATA Y AV. PEDRO GOYENA|LA PLATA AV. y GOYENA, PEDRO AV.|6
268|268|2017-0143|2017-11-25|2017|11|25|CONDUCTOR|AUTO|MASCULINO|50.0|2017-11-25 00:00:00|5|Saturday|PASAJEROS|21|-58.46442001|-34.60724519|TRELLES Y GRAL. CESAR DIAZ|TRELLES, MANUEL R. y DIAZ, CESAR, GRAL.|11
269|269|2017-0144|2017-11-26|2017|11|26|PASAJERO_ACOMPAÑANTE|AUTO|FEMENINO|50.0|2017-11-26 00:00:00|5|Sunday|OBJETO FIJO|6|-58.47064556|-34.69843756|AV. CNEL. ROCA Y COLECTORA AV. GRAL. PAZ|ROCA, CNEL. AV. y PAZ, GRAL. AV.|8
270|270|2017-0145|2017-11-26|2017|11|26|CONDUCTOR|MOTO|MASCULINO|58.0|2017-11-26 00:00:00|5|Sunday|AUTO|17|-58.41677733|-34.61223119|MAZA Y DON BOSCO|MAZA y DON BOSCO|5
271|271|2017-0147|2017-11-28|2017|11|28|CONDUCTOR|MOTO|MASCULINO|49.0|2017-11-28 00:00:00|5|Tuesday|AUTO|11|-58.5025179|-34.67450313|AV. GRAL. PAZ Y AV. EVA PERON|PAZ, GRAL. AV. y PERON, EVA AV.|9
272|272|2017-0148|2017-11-29|2017|11|29|PEATON|PEATON|FEMENINO|82.0|2017-11-29 00:00:00|6|Wednesday|PASAJEROS|10|-58.40708125|-34.62438894|AV. SAN JUAN Y LA RIOJA|SAN JUAN AV. y LA RIOJA|3
273|273|2017-0149|2017-11-30|2017|11|30|PEATON|PEATON|MASCULINO|13.0|2017-11-30 00:00:00|3|Thursday|PASAJEROS|12|-58.36947198|-34.61477051|AV. PASEO COLON Y MEXICO|PASEO COLON AV. y MEXICO|1
274|274|2017-0150|2017-12-04|2017|12|4|PEATON|PEATON|MASCULINO|56.0|2017-12-04 00:00:00|5|Monday|AUTO|1|-58.51140889|-34.63934531|AV. RIVADAVIA Y MIRALLA|RIVADAVIA AV. y MIRALLA|9
275|275|2017-0151|2017-12-04|2017|12|4|PEATON|PEATON|MASCULINO||2017-12-04 00:00:00|6|Monday|PASAJEROS|2|-58.37460912|-34.65559133|VIEYTES Y LUJAN|VIEYTES y LUJAN|4
276|276|2017-0152|2017-12-06|2017|12|6|CICLISTA|BICICLETA|MASCULINO|19.0|2017-12-06 00:00:00|4|Wednesday|PASAJEROS|17|-58.41146277|-34.65073916|CACHI Y TRAFUL|CACHI y TRAFUL|4
277|277|2017-0153|2017-12-11|2017|12|11|PASAJERO_ACOMPAÑANTE|MOTO|MASCULINO||2017-12-12 00:00:00|6|Monday|PASAJEROS|2|-58.42855267|-34.61829385|ROSARIO Y AV. LA PLATA|ROSARIO y LA PLATA AV.|6
278|278|2017-0153|2017-12-11|2017|12|11|CONDUCTOR|MOTO|MASCULINO|30.0|2017-12-12 00:00:00|5|Monday|PASAJEROS|2|-58.42855267|-34.61829385|ROSARIO Y AV. LA PLATA|ROSARIO y LA PLATA AV.|6
279|279|2017-0154|2017-12-11|2017|12|11|PEATON|PEATON|MASCULINO|76.0|2017-12-11 00:00:00|6|Monday|PASAJEROS|9|-58.39035581|-34.63412287|AV. ENTRE RIOS Y AV. CASEROS |ENTRE RIOS AV. y CASEROS AV.|4
280|280|2017-0155|2017-12-12|2017|12|12|SD|SD|MASCULINO|77.0|SD|6|Tuesday|MOTO|21|-58.45593915|-34.62656868|AV. RIVADAVIA 6350|RIVADAVIA AV. 6350|7
281|281|2017-0157|2017-12-17|2017|12|17|CONDUCTOR|AUTO|MASCULINO|53.0|2017-12-17 00:00:00|5|Sunday|PASAJEROS|9|-58.52866211|-34.64597065|AV. GRAL. PAZ Y HUMAITA|PAZ, GRAL. AV. y HUMAITA|9
282|282|2017-0158|2017-12-18|2017|12|18|CONDUCTOR|MOTO|MASCULINO|32.0|2017-12-18 00:00:00|5|Monday|AUTO|21|-58.52037476|-34.59407024|GUALEGUAYCHU Y COLECTORA AV. GRAL PAZ|GUALEGUAYCHU y PAZ, GRAL. AV.|11
283|283|2017-0159|2017-12-20|2017|12|20|CONDUCTOR|MOTO|MASCULINO|27.0|2017-12-20 00:00:00|4|Wednesday|AUTO|4|-58.38896772|-34.61799615|AV. INDEPENDENCIA Y VIRREY CEVALLOS|INDEPENDENCIA AV. y CEVALLOS, VIRREY|1
284|284|2017-0160|2017-12-22|2017|12|22|PEATON|PEATON|FEMENINO|30.0|2017-12-22 00:00:00|5|Friday|MOTO|13|-58.47074114|-34.62771756|AV. NAZCA 365|NAZCA AV. 365|7
285|285|2017-0161|2017-12-26|2017|12|26|PEATON|PEATON|FEMENINO|30.0|2017-12-26 00:00:00|5|Tuesday|AUTO|15|-58.48200819|-34.65969965|AV. EVA PERON 5249|PERON, EVA AV. 5249|9
286|286|2018-0001|2018-01-01|2018|1|1|PEATON|PEATON|MASCULINO|83.0|2018-01-02 00:00:00|6|Monday|MOTO|22|-58.39536773|-34.62297346|San Juan Av. Y Rincón|SAN JUAN AV. y RINCON|3
287|287|2018-0002|2018-01-03|2018|1|3|CICLISTA|BICICLETA|FEMENINO|26.0|2018-01-03 00:00:00|4|Wednesday|PASAJEROS|16|-58.37456088|-34.61895467|Peru 937|PERU 937|1
288|288|2018-0003|2018-01-05|2018|1|5|PEATON|PEATON|FEMENINO|58.0|2018-01-05 00:00:00|5|Friday|MULTIPLE|10|-58.44860217|-34.60395657|Pueyrredon, Honorio, Dr. Av. y Galicia|PUEYRREDON, HONORIO, DR. AV. y GALICIA|15
289|289|2018-0004|2018-01-09|2018|1|9|CONDUCTOR|MOTO|MASCULINO|39.0|2018-01-09 00:00:00|5|Tuesday|MULTIPLE|9|-58.46129513|-34.54332766|Del Libertador Av. y Manzanares|DEL LIBERTADOR AV. y MANZANARES|13
290|290|2018-0005|2018-01-09|2018|1|9|PEATON|PEATON|MASCULINO|54.0|2018-01-09 00:00:00|5|Tuesday|PASAJEROS|22|-58.36907201|-34.61953517|Paseo Colon Av. 1019|PASEO COLON AV. 1019|1
291|291|2018-0006|2018-01-10|2018|1|10|CICLISTA|BICICLETA|FEMENINO|45.0|2018-01-10 00:00:00|5|Wednesday|PASAJEROS|21|-58.44062219|-34.62499107|Valle y Barco Centenera Del|VALLE y BARCO CENTENERA DEL|6
292|292|2018-0007|2018-01-11|2018|1|11|CONDUCTOR|AUTO|MASCULINO|46.0|2018-01-11 00:00:00|5|Thursday|AUTO|2|-58.52502765|-34.63601265|AU Perito Moreno  KM 0.6|AUTOPISTA PERITO MORENO KM. 0.6|9
293|293|2018-0008|2018-01-12|2018|1|12|CONDUCTOR|MOTO|FEMENINO|32.0|2018-01-12 00:00:00|5|Friday|CARGAS|17|-58.36659655|-34.61687778|Huergo, Ing. Av. e Independencia Av.|HUERGO, ING. AV. e INDEPENDENCIA AV.|1
294|294|2018-0009|2018-01-14|2018|1|14|CONDUCTOR|MOTO|MASCULINO|19.0|2018-01-14 00:00:00|4|Sunday|MOTO|2|-58.36737389|-34.62763661|Pilcomayo y Brown, Alte. Av.|PILCOMAYO y BROWN, ALTE. AV.|4
295|295|2018-0010|2018-01-18|2018|1|18|CONDUCTOR|MOTO|MASCULINO|40.0|2018-01-18 00:00:00|5|Thursday|CARGAS|5|-58.49807953|-34.63038658|Cervantes y Belaustegui, Luis, Dr.|CERVANTES y BELAUSTEGUI, LUIS, DR.|10
296|296|2018-0011|2018-01-19|2018|1|19|PEATON|PEATON|MASCULINO|84.0|2018-01-19 00:00:00|6|Friday|PASAJEROS|10|-58.39092703|-34.59088447|Callao y Vte. Lopez|CALLAO AV. y LOPEZ, VICENTE|2
297|297|2018-0012|2018-01-26|2018|1|26|CONDUCTOR|MOTO|MASCULINO|20.0|2018-01-26 00:00:00|4|Friday|PASAJEROS|13|-58.46912006|-34.68049201|Oliden y Chilavert, Martiniano, Coronel|OLIDEN y CHILAVERT, MARTINIANO, CORONEL|8
298|298|2018-0013|2018-01-28|2018|1|28|CONDUCTOR|MOTO|MASCULINO|44.0|2018-01-28 00:00:00|5|Sunday|AUTO|8|-58.48661286|-34.56786129|Congreso Av. y Galvan|CONGRESO AV. y GALVAN|12
299|299|2018-0014|2018-01-31|2018|1|31|PEATON|PEATON|MASCULINO||2018-02-04 00:00:00|6|Wednesday|MOTO|20|-58.44074927|-34.65080597|Moreno, Perito Av. y Rivera Indarte|MORENO, PERITO AV. y RIVERA INDARTE AV.|7
300|300|2018-0015|2018-02-06|2018|2|6|CONDUCTOR|MOTO|MASCULINO|28.0|2018-02-06 00:00:00|4|Tuesday|PASAJEROS|1|-58.38636298|-34.64684275|Australia Av. 2800|AUSTRALIA AV. 2800|4
301|301|2018-0015|2018-02-06|2018|2|6|PASAJERO_ACOMPAÑANTE|MOTO|MASCULINO|19.0|2018-02-06 00:00:00|4|Tuesday|PASAJEROS|1|-58.38636298|-34.64684275|Australia Av. 2800|AUSTRALIA AV. 2800|4
302|302|2018-0016|2018-02-15|2018|2|15|CONDUCTOR|MOTO|MASCULINO|31.0|2018-02-15 00:00:00|5|Thursday|CARGAS|10|-58.37533517|-34.59276462|Del Libertador Av. y Ramos Mejia, Jose Maria, Dr. Av.|DEL LIBERTADOR AV. y RAMOS MEJIA, JOSE MARIA, DR. AV.|1
303|303|2018-0017|2018-02-17|2018|2|17|PEATON|PEATON|MASCULINO|35.0|2018-02-20 00:00:00|5|Saturday|AUTO|4|-58.46963952|-34.63070603|San Pedrito Av. y Rivadavia Av.|SAN PEDRITO AV. y RIVADAVIA AV.|7
304|304|2018-0018|2018-02-17|2018|2|17|CONDUCTOR|MOTO|MASCULINO|26.0|2018-02-17 00:00:00|4|Saturday|CARGAS|7|-58.37207554|-34.64543658|Isabel La Catolica y Salvadores, Cnel.|ISABEL LA CATOLICA y SALVADORES, CNEL.|4
305|305|2018-0019|2018-02-17|2018|2|17|PEATON|PEATON|FEMENINO|80.0|2018-02-17 00:00:00|6|Saturday|PASAJEROS|12|-58.39189441|-34.59176378|Las Heras General Av. y Callao Av.|LAS HERAS GENERAL AV. y CALLAO AV.|2
306|306|2018-0020|2018-02-19|2018|2|19|CONDUCTOR|MOTO|MASCULINO|26.0|2018-02-19 00:00:00|4|Monday|CARGAS|22|-58.45012957|-34.66518343|Fernandez de la Cruz Subida AU Héctor J. Cámpora|FERNANDEZ DE LA CRUZ F., GRAL. AV. y AUTOPISTA PRESIDENTE HECTOR J. CAMPORA|8
307|307|2018-0021|2018-02-22|2018|2|22|PEATON|PEATON|FEMENINO|62.0|2018-02-22 00:00:00|6|Thursday|PASAJEROS|10|-58.40184094|-34.64546845|AMANCIO ALCORTA Y ZAVALETA|ALCORTA, AMANCIO AV. y ZAVALETA|4
308|308|2018-0022|2018-02-24|2018|2|24|CONDUCTOR|MOTO|MASCULINO|28.0|2018-02-24 00:00:00|4|Saturday|CARGAS|0|-58.37441153|-34.63966783|Montes De Oca, Manuel y Olavarria|MONTES DE OCA, MANUEL AV. y OLAVARRIA|4
309|309|2018-0023|2018-02-24|2018|2|24|CONDUCTOR|MOTO|MASCULINO|28.0|2018-02-24 00:00:00|4|Saturday|AUTO|6|-58.44110156|-34.62082399|Barco Centenera Del y Rosario|BARCO CENTENERA DEL y ROSARIO|6
310|310|2018-0024|2018-02-28|2018|2|28|PEATON|PEATON|MASCULINO|70.0|2018-02-28 00:00:00|6|Wednesday|CARGAS|23|-58.47087351|-34.57827342|Alvarez Thomas Av. y Donado|ALVAREZ THOMAS AV. y DONADO|15
311|311|2018-0025|2018-03-04|2018|3|4|PEATON|PEATON|MASCULINO|70.0|2018-03-05 00:00:00|6|Sunday|AUTO|22|-58.4596221|-34.6224514|Av. Avellaneda y Av. Boyacá|AVELLANEDA AV. y BOYACA AV.|7
312|312|2018-0026|2018-03-09|2018|3|9|CONDUCTOR|MOVIL|MASCULINO|24.0|2018-03-09 00:00:00|4|Friday|CARGAS|4|-58.41657793|-34.65476216|Rabanal, Francisco, Intendente Av. y Saenz Av.|RABANAL, FRANCISCO, INTENDENTE AV. y SAENZ AV.|4
313|313|2018-0026|2018-03-09|2018|3|9|PASAJERO_ACOMPAÑANTE|MOVIL|MASCULINO|30.0|2018-03-09 00:00:00|5|Friday|CARGAS|4|-58.41657793|-34.65476216|Rabanal, Francisco, Intendente Av. y Saenz Av.|RABANAL, FRANCISCO, INTENDENTE AV. y SAENZ AV.|4
314|314|2018-0027|2018-03-11|2018|3|11|PEATON|PEATON|FEMENINO|74.0|2018-03-11 00:00:00|6|Sunday|MOTO|23|-58.41911301|-34.63722107|Castro y Rondeau|CASTRO y RONDEAU|5
315|315|2018-0028|2018-03-13|2018|3|13|PEATON|PEATON|MASCULINO|71.0|2018-03-13 00:00:00|6|Tuesday|CARGAS|15|-58.47120586|-34.64251042|Bilbao, Francisco Av. y Azul|BILBAO, FRANCISCO AV. y AZUL|9
316|316|2018-0029|2018-03-15|2018|3|15|CONDUCTOR|MOTO|MASCULINO|26.0|2018-03-15 00:00:00|4|Thursday|AUTO|18|-58.47418944|-34.62049672|Nazca Av. y Gaona Av.|NAZCA AV. y GAONA AV.|11
317|317|2018-0030|2018-03-20|2018|3|20|CONDUCTOR|MOTO|MASCULINO|24.0|2018-03-20 00:00:00|4|Tuesday|MOTO|1|-58.46720441|-34.57905579|Plaza y Alvarez Thomas Av.|PLAZA y ALVAREZ THOMAS AV.|15
318|318|2018-0031|2018-03-28|2018|3|28|CONDUCTOR|MOTO|MASCULINO|31.0|2018-03-28 00:00:00|5|Wednesday|CARGAS|10|-58.46909362|-34.6177971|Gaona Av. y Artigas, Jose Gervasio, Gral.|GAONA AV. y ARTIGAS, JOSE GERVASIO, GRAL.|11
319|319|2018-0032|2018-04-02|2018|4|2|PEATON|PEATON|MASCULINO|70.0|2018-04-02 00:00:00|6|Monday|PASAJEROS|13|-58.44704343|-34.5688864|Cabildo Av. y Aguilar|CABILDO AV. y AGUILAR|13
320|320|2018-0033|2018-04-07|2018|4|7|CONDUCTOR|MOTO|FEMENINO|42.0|2018-04-10 00:00:00|5|Saturday|CARGAS|7|-58.50535541|-34.62902048|Camarones y Lope De Vega Av.|CAMARONES y LOPE DE VEGA AV.|10
321|321|2018-0034|2018-04-11|2018|4|11|PEATON|PEATON|MASCULINO|24.0|2018-04-11 00:00:00|4|Wednesday|PASAJEROS|18|-58.40021675|-34.59522198|Santa Fe Av. 2320|SANTA FE AV. 2320|2
322|322|2018-0035|2018-04-12|2018|4|12|PEATON|PEATON|FEMENINO|39.0|2018-04-12 00:00:00|5|Thursday|PASAJEROS|16|-58.46325991|-34.62919627|Av. Rivadavia 6950|RIVADAVIA AV. 6950|7
323|323|2018-0036|2018-04-13|2018|4|13|CONDUCTOR|MOTO|MASCULINO|37.0|2018-04-15 00:00:00|5|Friday|AUTO|23|-58.49471482|-34.59694755|Av. San Martín y Argerich|SAN MARTIN AV. y ARGERICH|15
324|324|2018-0037|2018-04-18|2018|4|18|PEATON|PEATON|MASCULINO|84.0|2018-04-19 00:00:00|6|Wednesday|CARGAS|18|-58.3987261|-34.59975962|Cordoba Av. y Uriburu Jose E., Pres.|CORDOBA AV. y URIBURU JOSE E., PRES.|2
325|325|2018-0038|2018-04-20|2018|4|20|PEATON|PEATON|FEMENINO|59.0|2018-04-20 00:00:00|5|Friday|AUTO|17|-58.38872177|-34.60885045|AV. RIVADAVIA 1571|RIVADAVIA AV. 1571|1
326|326|2018-0038|2018-04-20|2018|4|20|PEATON|PEATON|MASCULINO|61.0|2018-04-20 00:00:00|6|Friday|AUTO|17|-58.38872177|-34.60885045|AV. RIVADAVIA 1571|RIVADAVIA AV. 1571|1
327|327|2018-0039|2018-04-21|2018|4|21|PEATON|PEATON|MASCULINO|37.0|2018-04-21 00:00:00|5|Saturday|AUTO|22|0.0|0.0|AUTOPISTA LUGONES KM 4.7||14
328|328|2018-0040|2018-04-27|2018|4|27|PEATON|PEATON|FEMENINO||2018-04-27 00:00:00|6|Friday|CARGAS|11|-58.45686132|-34.57305993|Ramon Freire y Virrey Olaguer y Feliu|FREIRE, RAMON, CAP. GRAL. y OLAGUER Y FELIU, VIRREY|13
329|329|2018-0041|2018-04-27|2018|4|27|PEATON|PEATON|FEMENINO|78.0|2018-04-27 00:00:00|6|Friday|PASAJEROS|13|-58.42281627|-34.64282424|La Plata Av. y Fernandez De La Cruz, F., Gral. Av.|LA PLATA AV. y FERNANDEZ DE LA CRUZ, F., GRAL. AV.|4
330|330|2018-0042|2018-04-27|2018|4|27|PASAJERO_ACOMPAÑANTE|MOTO|MASCULINO|23.0|2018-04-27 00:00:00|4|Friday|CARGAS|18|-58.38666024|-34.63953396|BRANDSEN y PERDRIEL|BRANDSEN y PERDRIEL|4
331|331|2018-0043|2018-04-28|2018|4|28|CONDUCTOR|MOTO|MASCULINO|25.0|2018-04-29 00:00:00|4|Saturday|AUTO|6|-58.49122843|-34.61207587|Vilardebo, Teodoro y Alvarez Jonte Av.|VILARDEBO, TEODORO y ALVAREZ JONTE AV.|11
332|332|2018-0044|2018-04-28|2018|4|28|PEATON|PEATON|FEMENINO|50.0|2018-04-28 00:00:00|5|Saturday|AUTO|9|-58.40098306|-34.61866627|Alberti e Independencia Av.|ALBERTI e INDEPENDENCIA AV.|3
333|333|2018-0045|2018-04-30|2018|4|30|CONDUCTOR|AUTO|MASCULINO|60.0|2018-04-30 00:00:00|6|Monday|CARGAS|7|-58.45448963|-34.5791692|Alvarez Thomas Av. 879|ALVAREZ THOMAS AV. 879|13
334|334|2018-0046|2018-05-02|2018|5|2|PEATON|PEATON|MASCULINO|11.0|2018-05-02 00:00:00|2|Wednesday|AUTO|3|-58.52927982|-34.63931752|Av. Gral. Paz y Av. Rivadavia|PAZ, GRAL. AV. y RIVADAVIA AV.|9
335|335|2018-0047|2018-05-08|2018|5|8|PEATON|PEATON|MASCULINO|82.0|2018-05-09 00:00:00|6|Tuesday|PASAJEROS|19|-58.44759966|-34.5917024|Av. Corrientes y Av. Dorrego|CORRIENTES AV. y DORREGO AV.|15
336|336|2018-0048|2018-05-09|2018|5|9|PEATON|PEATON|MASCULINO|57.0|2018-05-16 00:00:00|5|Wednesday|PASAJEROS|10|-58.46411215|-34.62925068|Rivadavia Av. y Pedernera|RIVADAVIA AV. y PEDERNERA|7
337|337|2018-0049|2018-05-11|2018|5|11|PEATON|PEATON|FEMENINO|40.0|2018-05-13 00:00:00|5|Friday|AUTO|19|-58.4621322|-34.55395823|Quesada 2300|QUESADA 2300|13
338|338|2018-0050|2018-05-14|2018|5|14|PEATON|PEATON|FEMENINO|47.0|2018-05-24 00:00:00|5|Monday|PASAJEROS|18|-58.45669422|-34.5620361|Cabildo Av. y Juramento Av.|CABILDO AV. y JURAMENTO AV.|13
339|339|2018-0051|2018-05-15|2018|5|15|PEATON|PEATON|FEMENINO|57.0|2018-05-15 00:00:00|5|Tuesday|AUTO|21|-58.3597716|-34.64341878|California y Carbonari, Francisco, Cmte.|CALIFORNIA y CARBONARI, FRANCISCO, CMTE.|4
340|340|2018-0052|2018-05-18|2018|5|18|PEATON|PEATON|MASCULINO|78.0|2018-05-19 00:00:00|6|Friday|PASAJEROS|20|-58.49820145|-34.59070093|Carril, Salvador Maria Del Av. y Nazca|CARRIL, SALVADOR MARIA DEL AV. y NAZCA|15
341|341|2018-0053|2018-05-20|2018|5|20|CONDUCTOR|MOTO|MASCULINO|43.0|2018-05-20 00:00:00|5|Sunday|AUTO|2|-58.4105928|-34.5993918|San Luis y Aguero|SAN LUIS y AGUERO|3
342|342|2018-0054|2018-05-22|2018|5|22|PEATON|PEATON|FEMENINO|86.0|2018-05-25 00:00:00|6|Tuesday|BICICLETA|11|-58.47969138|-34.57121563|Lugones 2430|LUGONES 2430|12
343|343|2018-0055|2018-05-29|2018|5|29|CONDUCTOR|MOTO|MASCULINO|21.0|2018-05-29 00:00:00|4|Tuesday|AUTO|7|-58.40351561|-34.61883916|Independencia Av. y Jujuy Av.|INDEPENDENCIA AV. y JUJUY AV.|3
344|344|2018-0056|2018-06-02|2018|6|2|PEATON|PEATON|FEMENINO|69.0|2018-06-04 00:00:00|6|Saturday|PASAJEROS|13|-58.51973844|-34.63918987|Av. Rivadavia 11050|RIVADAVIA AV. 11050|9
345|345|2018-0057|2018-06-03|2018|6|3|CONDUCTOR|MOTO|MASCULINO|33.0|2018-06-04 00:00:00|5|Sunday|PASAJEROS|3|-58.39311376|-34.62163006|Combate De Los Pozos y Humberto 1°|COMBATE DE LOS POZOS y HUMBERTO 1Â°|3
346|346|2018-0058|2018-06-03|2018|6|3|CONDUCTOR|MOTO|MASCULINO|26.0|2018-06-13 00:00:00|4|Sunday|AUTO|6|-58.43531242|-34.59082159|Cordoba Av. y Thames|CORDOBA AV. y THAMES|15
347|347|2018-0059|2018-06-08|2018|6|8|CONDUCTOR|MOTO|MASCULINO|54.0|2018-06-08 00:00:00|5|Friday|OTRO|6|-58.41178165|-34.63035454|Garay, Juan De Av. y Sanchez De Loria|GARAY, JUAN DE AV. y SANCHEZ DE LORIA|5
348|348|2018-0060|2018-06-08|2018|6|8|PEATON|PEATON|MASCULINO|51.0|2018-06-08 00:00:00|5|Friday|PASAJEROS|12|-58.370488|-34.60189492|Lavalle y Alem, Leandro N. Av.|LAVALLE y ALEM, LEANDRO N. AV.|1
349|349|2018-0061|2018-06-10|2018|6|10|CONDUCTOR|MOTO|MASCULINO|51.0|2018-06-10 00:00:00|5|Sunday|MOTO|11|-58.39883882|-34.61964833|Estados Unidos y Pichincha|ESTADOS UNIDOS y PICHINCHA|3
350|350|2018-0062|2018-06-14|2018|6|14|PEATON|PEATON|MASCULINO|32.0|2018-06-14 00:00:00|5|Thursday|CARGAS|1|-58.44110156|-34.62082399|Rosario y Barco Centenera Del|ROSARIO y BARCO CENTENERA DEL|6
351|351|2018-0063|2018-06-16|2018|6|16|PEATON|PEATON|FEMENINO|28.0|2018-06-17 00:00:00|4|Saturday|PASAJEROS|21|-58.37093138|-34.59952725|Av. Leandro N. Alem y Viamonte|ALEM, LEANDRO N. AV. y VIAMONTE|1
352|352|2018-0064|2018-06-25|2018|6|25|CONDUCTOR|AUTO|MASCULINO|30.0|2018-06-25 00:00:00|5|Monday|CARGAS|1|-58.45855262|-34.63953253|Varela Av. y Primera Junta|VARELA AV. y PRIMERA JUNTA|7
353|353|2018-0065|2018-06-26|2018|6|26|CONDUCTOR|MOTO|MASCULINO|35.0|2018-06-26 00:00:00|5|Tuesday|CARGAS|17|-58.38161909|-34.59283447|Pellegrini, Carlos y Juncal|PELLEGRINI, CARLOS y JUNCAL|1
354|354|2018-0066|2018-06-28|2018|6|28|PEATON|PEATON|MASCULINO|73.0|2018-06-28 00:00:00|6|Thursday|PASAJEROS|11|-58.45511899|-34.58698157|Av. Corrientes y Av. Federico Lacroze|CORRIENTES AV. y LACROZE, FEDERICO AV.|15
355|355|2018-0067|2018-06-29|2018|6|29|PASAJERO_ACOMPAÑANTE|PASAJEROS|FEMENINO|81.0|2018-07-06 00:00:00|6|Friday|AUTO|16|-58.37724226|-34.62973033|Montes De Oca, Manuel y Finochietto Enrique Dr.|MONTES DE OCA, MANUEL AV. y FINOCHIETTO ENRIQUE DR.|4
356|356|2018-0068|2018-07-01|2018|7|1|CONDUCTOR|MOTO|MASCULINO|21.0|2018-07-01 00:00:00|4|Sunday|AUTO|9|-58.45546217|-34.62930339|Carabobo Av. y Alberdi, Juan Bautista Av.|CARABOBO AV. y ALBERDI, JUAN BAUTISTA AV.|7
357|357|2018-0069|2018-07-04|2018|7|4|CICLISTA|BICICLETA|MASCULINO|20.0|2018-07-04 00:00:00|4|Wednesday|PASAJEROS|21|-58.39897064|-34.59954925|"Córdoba Av. 2215

"|CORDOBA AV. 2215|2
358|358|2018-0070|2018-07-07|2018|7|7|CONDUCTOR|MOTO|MASCULINO|33.0|2018-07-07 00:00:00|5|Saturday|PASAJEROS|15|-58.40917826|-34.62126274|Estados Unidos y Urquiza, Gral.|ESTADOS UNIDOS y URQUIZA, GRAL.|3
359|359|2018-0071|2018-07-10|2018|7|10|CONDUCTOR|MOTO|MASCULINO||2018-07-10 00:00:00|6|Tuesday|CARGAS|17|-58.36726348|-34.61099738|Moreno y Av. Huergo|MORENO y HUERGO, ING. AV.|1
360|360|2018-0072|2018-07-11|2018|7|11|CONDUCTOR|MOTO|MASCULINO|27.0|2018-07-13 00:00:00|4|Wednesday|CARGAS|13|-58.48267426|-34.68454456|AU Dellepiane kilometro 0.0, altura calle Montiel, sentido hacia el Centro Porteño|AUTOPISTA DELLEPIANE LUIS TTE. GRAL. y MONTIEL|8
361|361|2018-0073|2018-07-11|2018|7|11|PEATON|PEATON|FEMENINO|67.0|2018-07-11 00:00:00|6|Wednesday|CARGAS|15|-58.39546165|-34.65168841|Iriarte, Gral. Av. 3400|IRIARTE, GRAL. AV. 3400|4
362|362|2018-0074|2018-07-14|2018|7|14|CONDUCTOR|AUTO|MASCULINO|25.0|2018-07-14 00:00:00|4|Saturday|CARGAS|6|-58.46941984|-34.63376545|AV. JUAN B. ALBERDI 2968|ALBERDI, JUAN BAUTISTA AV. 2968|7
363|363|2018-0075|2018-07-15|2018|7|15|PEATON|PEATON|MASCULINO|23.0|2018-07-15 00:00:00|4|Sunday|AUTO|7|-58.40367321|-34.58129246|Del Libertador Av. y Ortiz De Ocampo|DEL LIBERTADOR AV. y ORTIZ DE OCAMPO|14
364|364|2018-0076|2018-07-16|2018|7|16|CONDUCTOR|AUTO|MASCULINO|73.0|2018-07-16 00:00:00|6|Monday|CARGAS|9|-58.52932872|-34.65014993|Chavez, Jorge y Paz, Gral. Av.|CHAVEZ, JORGE y PAZ, GRAL. AV.|9
365|365|2018-0077|2018-07-16|2018|7|16|CONDUCTOR|AUTO|MASCULINO|58.0|2018-07-17 00:00:00|5|Monday|CARGAS|23|-58.40917826|-34.62126274|Urquiza, Gral. y Estados Unidos|URQUIZA, GRAL. y ESTADOS UNIDOS|3
366|366|2018-0078|2018-07-21|2018|7|21|PEATON|PEATON|MASCULINO|27.0|2018-07-21 00:00:00|4|Saturday|AUTO|6|-58.41264127|-34.59473294|Paraguay y Sánchez De Bustamante|PARAGUAY y SANCHEZ DE BUSTAMANTE|2
367|367|2018-0079|2018-07-23|2018|7|23|PEATON|PEATON|MASCULINO||2018-07-23 00:00:00|6|Monday|CARGAS|7|-58.50877521|-34.66977709|De Los Corrales Av. y Paz, Gral. Av.|DE LOS CORRALES AV. y PAZ, GRAL. AV.|9
368|368|2018-0080|2018-07-25|2018|7|25|PEATON|PEATON|MASCULINO|26.0|2018-07-25 00:00:00|4|Wednesday|AUTO|22|-58.51232237|-34.6590353|Alberdi, Juan Bautista Av. y Carhue|ALBERDI, JUAN BAUTISTA AV. y CARHUE|9
369|369|2018-0081|2018-07-29|2018|7|29|PEATON|PEATON|MASCULINO|35.0|2018-07-29 00:00:00|5|Sunday|MULTIPLE|6|-58.44744156|-34.64567171|Castañares Av. y Rivera Indarte Av.|CASTAÃ‘ARES AV. y RIVERA INDARTE AV.|7
370|370|2018-0082|2018-08-01|2018|8|1|CONDUCTOR|MOTO|FEMENINO|17.0|2018-08-01 00:00:00|3|Wednesday|CARGAS|15|-58.49441273|-34.65869968|Larrazabal y Garzon, Eugenio, Gral. Av.|LARRAZABAL y GARZON, EUGENIO, GRAL. AV.|9
371|371|2018-0083|2018-08-02|2018|8|2|CONDUCTOR|MOTO|MASCULINO||2018-08-02 00:00:00|6|Thursday|CARGAS|5|-58.47976785|-34.69153196|Paz, Gral. Av. y Fernandez De La Cruz, F., Gral. Av.|PAZ, GRAL. AV. y FERNANDEZ DE LA CRUZ, F., GRAL. AV.|8
372|372|2018-0084|2018-08-03|2018|8|3|PEATON|PEATON|MASCULINO|45.0|2018-08-03 00:00:00|5|Friday|CARGAS|7|-58.36523349|-34.62260331|Av. Alicia Moreau de Justo y Cochabamba|MOREAU DE JUSTO, ALICIA AV. y COCHABAMBA|1
373|373|2018-0085|2018-08-03|2018|8|3|PASAJERO_ACOMPAÑANTE|MOTO|FEMENINO|22.0|2018-08-03 00:00:00|4|Friday|PASAJEROS|18|-58.39118948|-34.62704273|Entre Rios Av. y Garay, Juan De Av.|ENTRE RIOS AV. y GARAY, JUAN DE AV.|3
374|374|2018-0085|2018-08-03|2018|8|3|CONDUCTOR|MOTO|MASCULINO|30.0|2018-08-03 00:00:00|5|Friday|PASAJEROS|18|-58.39118948|-34.62704273|Entre Rios Av. y Garay, Juan De Av.|ENTRE RIOS AV. y GARAY, JUAN DE AV.|3
375|375|2018-0086|2018-08-10|2018|8|10|PEATON|PEATON|MASCULINO|40.0|2018-08-10 00:00:00|5|Friday|PASAJEROS|21|-58.49019551|-34.65015854|Directorio Av. y Guardia Nacional|DIRECTORIO AV. y GUARDIA NACIONAL|9
376|376|2018-0087|2018-08-15|2018|8|15|PEATON|PEATON|MASCULINO|75.0|2018-08-20 00:00:00|6|Wednesday|PASAJEROS|19|-58.41644362|-34.63023775|Pavon Av. Y Colombres|PAVON AV. y COLOMBRES|5
377|377|2018-0088|2018-08-17|2018|8|17|CONDUCTOR|MOTO|MASCULINO||2018-08-17 00:00:00|6|Friday|CARGAS|16|-58.5007381|-34.5497951|Av. Gral. Paz y Av. Dr. Ricardo Balbín|PAZ, GRAL. AV. y BALBIN, RICARDO, DR. AV.|12
378|378|2018-0089|2018-08-17|2018|8|17|PEATON|PEATON|MASCULINO|80.0|2018-08-17 00:00:00|6|Friday|PASAJEROS|17|-58.39626094|-34.63036565|Pichincha Av. y Brasil|PICHINCHA AV. y BRASIL|4
379|379|2018-0090|2018-08-18|2018|8|18|CONDUCTOR|MOTO|MASCULINO|27.0|2018-08-18 00:00:00|4|Saturday|AUTO|10|-58.43284809|-34.67051543|27 De Febrero Av. y Pergamino|27 DE FEBRERO AV. y PERGAMINO|8
380|380|2018-0091|2018-08-19|2018|8|19|PASAJERO_ACOMPAÑANTE|AUTO|FEMENINO|23.0|2018-08-19 00:00:00|4|Sunday|AUTO|18|-58.52280139|-34.63659934|AU Perito Moreno KM 1.8 ALTURA BARRAGAN SENTIDO PBA|AUTOPISTA PERITO MORENO y BARRAGAN|9
381|381|2018-0092|2018-08-20|2018|8|20|CONDUCTOR|MOTO|MASCULINO|23.0|2018-08-20 00:00:00|4|Monday|AUTO|8|-58.4233693|-34.59774487|Cordoba Av. y Gascon|CORDOBA AV. y GASCON|14
382|382|2018-0093|2018-08-20|2018|8|20|PEATON|PEATON|MASCULINO|24.0|2018-08-20 00:00:00|4|Monday|PASAJEROS|8|-58.38691681|-34.63105973|15 De Noviembre De 1889 1513|15 DE NOVIEMBRE DE 1889 1513|1
383|383|2018-0094|2018-08-23|2018|8|23|CONDUCTOR|MOTO|MASCULINO|32.0|2018-08-23 00:00:00|5|Thursday|PASAJEROS|5|-58.4116902|-34.5857988|Salguero, Jeronimo y Beruti|SALGUERO, JERONIMO y BERUTI|14
384|384|2018-0095|2018-08-26|2018|8|26|PASAJERO_ACOMPAÑANTE|AUTO|FEMENINO|49.0|2018-08-26 00:00:00|5|Sunday|AUTO|0|-58.46739825|-34.65117757|Lacarra Av. y Dellepiane, Luis, Tte. Gral.|LACARRA AV. y DELLEPIANE, LUIS, TTE. GRAL.|9
385|385|2018-0096|2018-08-31|2018|8|31|PEATON|PEATON|MASCULINO|39.0|2018-08-31 00:00:00|5|Friday|AUTO|22|-58.44483258|-34.67152226|AU Héctor J. Cámpora y Roca, Cnel. Av.|AUTOPISTA PRESIDENTE HÃ‰CTOR J. CÃMPORA y ROCA, CNEL. AV.|8
386|386|2018-0097|2018-09-02|2018|9|2|CONDUCTOR|AUTO|FEMENINO|35.0|2018-09-02 00:00:00|5|Sunday|OTRO|10|-58.43254025|-34.66128115|Av. Varela y Av. Int. Francisco Rabanal|VARELA AV. y RABANAL, FRANCISCO, INTENDENTE AV.|8
387|387|2018-0098|2018-09-09|2018|9|9|CONDUCTOR|AUTO|MASCULINO|55.0|2018-09-09 00:00:00|5|Sunday|AUTO|5|-58.47199387|-34.69640164|Av. Gral. Paz e/ Ferre y Beron de Astrada|PAZ, GRAL. AV. y BERON DE ASTRADA|8
388|388|2018-0098|2018-09-09|2018|9|9|PASAJERO_ACOMPAÑANTE|AUTO|MASCULINO|54.0|2018-09-09 00:00:00|5|Sunday|AUTO|5|-58.47199387|-34.69640164|Av. Gral. Paz e/ Ferre y Beron de Astrada|PAZ, GRAL. AV. y BERON DE ASTRADA|8
389|389|2018-0099|2018-09-12|2018|9|12|PEATON|PEATON|MASCULINO|18.0|2018-09-13 00:00:00|4|Wednesday|PASAJEROS|14|-58.46411215|-34.62925068|Rivadavia Av. y Pedernera|RIVADAVIA AV. y PEDERNERA|7
390|390|2018-0100|2018-09-20|2018|9|20|SD|MOTO|FEMENINO|33.0|2018-09-20 00:00:00|5|Thursday|AUTO|10|-58.36217754|-34.62367156|Elvira Rawson de Dellepiane 150|RAWSON DE DELLEPIANE, ELVIRA AV. 150|1
391|391|2018-0101|2018-09-21|2018|9|21|CONDUCTOR|AUTO|MASCULINO||2018-09-21 00:00:00|6|Friday|MULTIPLE|0|-58.48098594|-34.5407313|Paz, Gral. Av. y Zapiola|PAZ, GRAL. AV. y ZAPIOLA|12
392|392|2018-0102|2018-09-21|2018|9|21|CONDUCTOR|MOTO|MASCULINO|20.0|2018-09-21 00:00:00|4|Friday|AUTO|0|-58.41083404|-34.64640709|FAMATINA Y DIOGENES TABORDA|FAMATINA y TABORDA, DIOGENES|4
393|393|2018-0103|2018-09-27|2018|9|27|PEATON|PEATON|MASCULINO|1.0|2018-09-29 00:00:00|1|Thursday|MOTO|17|-58.44609828|-34.64446729|Av. Castañares y Bonorino|CASTAÃ‘ARES AV. y BONORINO, ESTEBAN, CNEL. AV.|7
394|394|2018-0104|2018-10-01|2018|10|1|CONDUCTOR|MOTO|MASCULINO|22.0|2018-10-01 00:00:00|4|Monday|MOTO|8|-58.37709334|-34.64035082|AU Frondizi 9 de Julio Sur y Av. Suarez|AUTOPISTA 1 SUR PRESIDENTE ARTURO FRONDIZI y SUAREZ AV.|4
395|395|2018-0105|2018-10-03|2018|10|3|PEATON|PEATON|FEMENINO|56.0|2018-10-03 00:00:00|5|Wednesday|PASAJEROS|18|-58.46963952|-34.63070603|Nazca Av. y Rivadavia Av.|NAZCA AV. y RIVADAVIA AV.|7
396|396|2018-0106|2018-10-04|2018|10|4|CONDUCTOR|MOTO|MASCULINO|27.0|2018-10-04 00:00:00|4|Thursday|MOTO|22|-58.43674281|-34.55161027|Figueroa Alcorta, Pres. Av. y Echeverria|FIGUEROA ALCORTA, PRES. AV. y ECHEVERRIA|13
